"wish, wish well",feel or express a desire or hope concerning the future or fortune of,"dilemek, ummak",Bir şeyin gerçekleşmesini veya olmasını istemek.
"name, call",assign a specified (usually proper) proper name to,"isim vermek, ad takmak, ad koymak, adlandırmak","Çağırmak veya anmak için bir canlıya, bir yere, bir şeye ad vermek."
nest,a structure in which animals lay eggs or give birth to their young,"yuva, kuluçka","Kuşların ve başka hayvanların barınmak, yumurtlamak, kuluçkaya yatmak, yavrularını büyütmek veya yavrulamak için türlü şeylerden yaptıkları ve türlü biçimlerde hazırladıkları barınak."
"desire, want",feel or have a desire for; want strongly,"arzulamak, istemek","bir şeye karşı eğilim duymak, arzulamak."
new,not of long duration; having just (or relatively recently) come into being or been made or acquired or discovered,yeni,Oluş veya çıkışından beri çok zaman geçmemiş olan
leg,a structure in animals that is similar to a human leg and used for locomotion,bacak,Vücudun kasıktan tabana kadar olan bölümü; hayvanlarda yürümeye veya atlamaya yarayan organ.
"mail, post, send",cause to be directed or transmitted to another place,"göndermek, postalamak, yollamak, iletmek","Bir yere doğru yola çıkarmak, ulaşmasını, gitmesini sağlamak"
thigh,the part of the leg between the hip and the knee,uyluk,Kalçadan dize kadar olan bacak bölümü.
"fairytale, fairy tale, fairy story",a story about fairies; told to amuse children,"peri masalı, masal","Genellikle halkın yarattığı, hayale dayanan, sözlü gelenekte yaşayan, çoğunlukla insanlar, hayvanlar ile cadı, cin, dev, peri vb. varlıkların başından geçen olağanüstü olayları anlatan edebî tür."
"hide, pelt, skin",body covering of a living animal,"post, deri","hayvan vücudunu kaplayan tüy, kıl veya pulla kaplı tabaka."
"foot, human foot, pes",the part of the leg of a human being below the ankle joint,ayak,Bacakların bilekten aşağıda bulunan ve yere basan bölümü.
arm,a human limb; technically the part of the superior limb between the shoulder and the elbow but commonly used to refer to the whole superior limb,kol,İnsan vücudunda omuz başından parmak uçlarına kadar uzanan bölüm.
"feather, plume, plumage",the light horny waterproof structure forming the external covering of birds,"kuş,kuştüyü",Kuşların gövdesini örten ince ve tel gibi uzantıların her biri veya tamamı.
"cargo, lading, freight, load, loading, payload, shipment, consignment",goods carried by a large vehicle,"kargo, yük, sevkiyat, gönderi, navlun, nakliye, parti, sevk, konsinye, mal","Araba, hayvan vb.nin taşıdığı şeylerin hepsi."
knock,rap with the knuckles,"çalmak, vurmak, tıklamak",Ses çıkarmak için bir şeyi başka bir şey üzerine hızlıca çarpmak.
old,(used especially of persons) having lived for a relatively long time or attained a specific age,"yaşlı, ihtiyar, yaş","Yaşı ilerlemiş, kocamış (kimse) veya uzun yılları geride bırakmış.; Doğuştan beri geçen ve yıl birimi ile ölçülen zaman."
"hand, manus, mitt, paw",the (prehensile) extremity of the superior limb,"el, pençe, pati","Kolun bilekten parmak uçlarına kadar olan, tutmaya ve iş yapmaya yarayan bölümü."
"palm, thenar",the inner surface of the hand from the wrist to the base of the fingers,"avuç, avuç içi, aya",Elin parmak uçlarıyla bilek arasındaki iç bölümü.
"opening, gap",an open or empty space in or between things,"açıklık, boşluk, aralık",İki şey arasındaki mesafe.
finger,any of the terminal members of the hand (sometimes excepting the thumb),parmak,"İnsanda ve bazı hayvanlarda ellerin ve ayakların son bölümünü oluşturan, boğumlu, oynak, uzunca organların her biri."
yesterday,on the day preceding today,dün,Bugünden bir önceki gün.
sell,exchange or deliver for money or its equivalent,satmak,Bir malı bir bedel karşılığında alıcıya vermek.
behind,in or to or toward the rear,arka,Geriye doğru
"fence, fencing",a barrier that serves to enclose an area,çit,"Bağ, bahçe, bostan vb. yerlerin çevresine çalı, kamış, ağaç dalı gibi şeylerden çekilen duvar türü."
add,"make an addition  (to); join or combine or unite with others; increase the quality, quantity, size or scope of",eklemek,"ek katmak, ek katarak bütünlemek ya da büyütmek; birleştirerek birbirine katmak, ek olarak kullanmak, ulamak."
"day, twenty-four hours, twenty-four hour period, 24-hour interval, solar day, mean solar day",time for Earth to make a complete rotation on its axis,"gün, yirmi dört saat, güneş günü, ortalama güneş günü",Yer yuvarlağının kendi ekseni etrafında bir kez dönmesiyle geçen 24 saatlik süre.
"part, piece",a portion of a natural object,"parça, bölüm","Bir bütünden ayrılan, ayrı sayılan veya artakalan şey."
"young, immature",(used of living things especially persons) in an early period of life or development or growth,genç,"Yaşı ilerlememiş olan, ihtiyar karşıtı"
"brother, blood brother",a male with the same parents as someone else,GAP,
"chew the fat, shoot the breeze, chat, confabulate, confab, chitchat, chatter, chaffer, natter, gossip, jaw, claver, visit",talk socially without exchanging too much information,"sohbet etmek, konuşmak,havadan sudan konuşmak, gevezelik etmek, laklak etmek, geyik yapmak, makara yapmak, çene çalmak, kaynatmak, laflamak, iki lafın belini kırmak, dedikodu yapmak, gıybet etmek, lakırdamak, yarenlik etmek, zevzeklik etmek","iki veya daha fazla kişi aralarında dostça, arkadaşça konuşmak,"
table,a piece of furniture having a smooth flat top that is usually supported by one or more vertical legs,masa,Ayaklar veya bir destek üzerine oturtulmuş tabladan oluşan mobilya.
"sleep, slumber",a natural and periodic state of rest during which consciousness of the world is suspended,uyku,"Dış uyaranlara karşı bilincin, bütünüyle veya bir bölümünün yittiği, tepki gücünün zayıfladığı ve her türlü etkinliğin büyük ölçüde azaldığı dinlenme durumu"
"travel, go, move, locomote","change location; move, travel, or proceed","seyahat etmek, yolculuk etmek, dolaşmak, hareket etmek, gitmek, gezmek, gitmek",bir yerden başka bir yere gitmek
"surviving, living",still in existence,"sağ, sağ kalan, hayatta kalan, canlı","Yaşamakta olan, yaşayan."
understand,know and comprehend the nature or meaning of,anlamak,"Bir şeyin ne demek olduğunu, neye işaret ettiğini kavramak."
"pit, cavity",a sizeable hole (usually in the ground),"çukur, oyuk, boşluk",Çevresine göre aşağı çökmüş olan yer.
whistle,utter or express by whistling,GAP,
laughter,the activity of laughing; the manifestation of joy or mirth or scorn,"kahkaha, gülmek",Yüksek sesle gülme.
"knee, knee joint, human knee, articulatio genus, genu",hinge joint in the human leg connecting the tibia and fibula with the femur and protected in front by the patella,"diz, diz eklemi, genu",insan bacağında kaval kemiği ve baldır kemiğini uyluk kemiği ile bağlayan eklem
"understand, read, interpret, translate",make sense of a language,"anlamak, okumak, yorumlamak, tercüme etmek, çevirmek",bir dilin anlamını çıkarmak
precipice,a very steep cliff,"sarp kayalık, uçurum, yar","Deniz, göl, ırmak vb. su kıyılarında veya karada dik yer."
pay,"give money, usually in exchange for goods or services",ödemek,"Bir alışveriş ilişkisinde, borcu alacaklıya vermek."
walk,the act of walking somewhere,yürüyüş,Yürümek işi
"sunday, lord's day, dominicus, sun",first day of the week; observed as a day of rest and worship by most Christians,Pazar,Cumartesi ile pazartesi arasındaki gün.
"groan, moan, sough","indicate pain, discomfort, or displeasure","inlemek, sızlanmak, uğuldamak, feryat etmek","Acı, üzüntü belirten sesler çıkarmak"
"know, cognize, cognise",be cognizant or aware of a fact or a specific piece of information; possess knowledge or information about,"bilmek, tanımak, kavramak","Bir şey hakkında bilgi sahibi olmak, öğrenmiş bulunmak."
"tuesday, tues",the third day of the week; the second working day,Salı,Pazartesi ile çarşamba arasındaki gün
"roar, howl","make a loud noise, as of wind, water, or vehicles","kükremek, ulumak","Aslan, bağırmak; deniz, nehir kabarmak, taşmak; kızgınlık ve öfke ile yüksek sesle bağırmak."
"monday, mon",the second day of the week; the first working day,Pazartesi,Pazar ile salı arasındaki gün
"discontinue, stop, cease, give up, quit, lay off",put an end to a state or an activity,"kesmek, durdurmak, son vermek, sonlandırmak, engellemek, yarıda bırakmak, bırakmak",Bir şeyin gerçekleşmesini veya yapılmasını önlemek
"open, unfastened",affording unobstructed entrance and exit; not shut or closed,açık,"Engelsiz, serbest olan"
"thursday, th",the fifth day of the week; the fourth working day,Perşembe,Çarşamba ile cuma arasındaki gün.
"pay, pay off, make up, compensate",do or give something to somebody in return,"para vermek, ödemek, ücret ödemek","Bir işin, bir görevin karşılığını vermek"
"shut, unopen, closed",not open,kapalı,"Kapanmış olan, açılmamış, açık karşıtı."
"wednesday, midweek, wed",the fourth day of the week; the third working day,Çarşamba,Salı ile perşembe arasındaki gün.
lock,a fastener fitted to a door or drawer to keep it firmly closed,kilit,"Anahtar, düğme gibi takılıp çıkarılabilen bir parça yardımıyla çalışan kapatma aleti."
"saturday, sabbatum, sat",the seventh and last day of the week; observed as the Sabbath by Jews and some Christians,Cumartesi,Cuma ile pazar arasındaki gün.
"friday, fri",the sixth day of the week; the fifth working day,Cuma,Perşembe ile cumartesi arasındaki gün.
thunder,to make or produce a loud noise,gümbürdemek," ""Gümbür"" diye ses çıkarmak"
expensive,high in price or charging high prices,pahalı,Fiyatı yüksek olan
"noon, twelve noon, high noon, midday, noonday, noontide",the middle of the day,"öğle, öğle vakti, öğlen, gün ortası",Güneşin gökyüzünde en yüksek noktada bulunduğu sabahla ikindi arasındaki zaman dilimi.
"morning, morn, morning time, forenoon",the time period between dawn and noon,"sabah, öğleden evvel, öğleden önce",Güneşin doğduğu andan öğleye kadar geçen zaman dilimi.
"howl, wrawl, yammer, yowl","cry loudly, as of animals","ulumak, inlemek, sızlanmak","Köpek, kurt, çakal vb. hayvanlar uzun, iniltili, ağlar gibi bir ses çıkarmak."
"learn, larn, acquire",gain knowledge or skills,"öğrenmek, edinmek",Bilgi edinmek
bark,make barking sounds,havlamak,Köpek bağırmak; ürümek.
rainbow,an arc of colored light in the sky caused by refraction of the sun's rays by rain,"gökkuşağı, ebemkuşağı, eleğimsağma, yağmur kuşağı,  Meryem Ana kuşağı",Yağmur damlacıklarından geçen güneş ışınlarının kırılıp yansımasıyla gökyüzünde oluşan yedi renkli kemer biçimindeki görüntü.
toe,one of the digits of the foot,"parmak, ayak parmağı","İnsanda ve bazı hayvanlarda ellerin ve ayakların son bölümünü oluşturan, boğumlu, oynak, uzunca organların her biri"
"cheap, inexpensive",relatively low in price or charging low prices,ucuz,"Fiyatı yüksek olmayan, pahası az, düşük fiyatlı."
"evening, eve, even, eventide",the latter part of the day (the period of decreasing daylight from late afternoon until nightfall),"akşam, akşam vakti",Güneşin batmasına yakın zamandan gecenin başlamasına kadar geçen zaman dilimi
"night, nighttime, dark",the time after sunset and before sunrise while it is dark outside,"gece, gece vakti, karanlık",Akşamdan sonra başlayan ve gün ağarıncaya kadar geçen zaman dilimi
heel,the back part of the human foot,"topuk, ökçe, taban",İnsan ayağının toparlakça olan alt arka bölümü
milk,take milk from female mammals,süt,"Kadınların ve memeli dişi hayvanların yavrularını besledikleri, memelerinden gelen, besin değeri yüksek beyaz sıvı."
"run, go, pass, lead, extend","stretch out over a distance, space, time, or scope; run or extend between two points or beyond a certain point","uzanmak, uzağa gitmek, ileri gitmek, kapsamak, ötesine uzanmak",Bir alana yayılmak
"go, go away, depart",move away from a place into another direction,"ayrılmak, uzaklaşmak, gitmek","Bir şeyden, bir yerden veya kimseden ayrılıp uzağa gitmek"
"king, male monarch, rex",a male sovereign; ruler of a kingdom,"kral, erkek hükümdar, hükümdar","En yüksek devlet otoritesini, bütün devlet başkanlığı yetkilerini kalıtım veya soylularca seçilme yoluyla elinde bulunduran kimse."
"elbow, elbow joint, human elbow, cubitus, cubital joint, articulatio cubiti",hinge joint between the forearm and upper arm and the corresponding joint in the forelimb of a quadruped,"dirsek, kubitus, dirsek eklemi",Kol ile ön kol arasındaki eklemin arka yanı.
"kiss, buss, osculate","touch with the lips or press the lips (against someone's mouth or other body part) as an expression of love, greeting, etc.","öpmek, buse kondurmak, değdirmek, yaslamak, temas etmek","Sevgi, saygı, bağlılık, teşekkür belirtmek amacıyla dudaklarını bir şeye veya birine değdirmek."
"address, speech",the act of delivering a formal spoken communication to an audience,"hitap etmek, seslenmek,konuşmak"," ... -e karşı söylemek, söz yöneltmek"
"ribbon, thread",any long object resembling a thin line,"şerit, bant, sicim","Herhangi bir maddenin dar, düz, ince ve uzun parçası."
"lick, lap",pass the tongue over,yalamak,Bir şeyin üzerinden dilini sürüp geçirmek.
"week, hebdomad",any period of seven consecutive days,hafta,Birbiri ardınca gelen yedi günlük dönem.
nail,horny plate covering and protecting part of the dorsal surface of the digits,tırnak,nsanda ve birçok omurgalı hayvanda parmak uçlarının dış bölümünü örten boynuzsu tabaka.
"hunger, hungriness",a physiological need for food; the consequence of food deprivation,açlık,Aç olma durumu
river,a large natural stream of water (larger than a creek),"nehir, ırmak","Çoğunlukla denize dökülen, özellikle genişliği ve taşıdığı su niceliği bakımından en büyük akarsu."
"rock, stone",a lump or mass of hard consolidated mineral matter,taş,"Kimyasal veya fiziksel durumu değişiklikler gösteren, rengini içindeki maden, tuz ve oksitlerden alan sert ve katı madde."
donate,give to a charity or good cause,"bağışlamak, bağışta bulunmak, bağış yapmak","Bir kimse, kuruluş veya ülke ayni veya nakdi varlıklarını kendi iradesi ile bir başka kişi, kurum veya tüzel kişiliklere karşılıksız olarak devretmek."
fingernail,the nail at the end of a finger,tırnak,İnsanda ve birçok omurgalı hayvanda parmak uçlarının dış bölümünü örten boynuzsu tabaka.
beautiful,delighting the senses or exciting intellectual or emotional admiration,güzel,"Göze ve kulağa hoş gelen, hayranlık uyandıran, çirkin karşıtı."
"fine-looking, good-looking, better-looking, handsome, well-favored, well-favoured",pleasing in appearance especially by reason of conformity to ideals of form and proportion,"hoş, güzel, iyi, yakışıklı, güzel","İstenilen, beğenilen nitelikleri taşıyan, beğenilecek biçimde olan."
rich,possessing material wealth,"zengin, varlıklı","Parası, malı çok olan."
"remember, retrieve, recall, call back, call up, recollect, think",recall knowledge from memory; have a recollection,"hatırlamak, anımsamak, çağrıştırmak, akla gelmek",Bilinip unutulan bir şeyi akla getirmek.
poor,having little money or few possessions,"fakir, yoksul","Geçinmekte çok sıkıntı çeken, geçimini güçlükle sağlayan (kimse, toplum, ülke)."
"forget, block, blank out, draw a blank",be unable to remember,"unutmak, hatırlamamak, aklından çıkmak, aklında kalmamak",belleğinde kalmamış olmak
"catch, grab, take hold of",take hold of so as to seize or restrain or stop the motion of,"yakalamak, tutmak","gitmesini engellemek, durdurmak"
sea,a division of an ocean or a large body of salt water partially enclosed by land,deniz,"Yer kabuğunun çukur bölümlerini kaplayan, birbiriyle bağlantılı, tuzlu su kütlesi."
"seashore, coast, seacoast, sea-coast",the shore of a sea or ocean,"kıyı, sahil",Kara ile suyun birleştiği yer
"stop, halt","come to a halt, stop moving","durdurmak, kesmek",Durmasını sağlamak; son vermek
butterfly,diurnal insect typically having a slender body with knobbed antennae and broad colorful wings,kelebek,"Pul kanatlılardan, vücudu, kanatları ince pullarla ve türlü renklerle örtülü, dört kanatlı, çok sayıda türleri olan böceklere verilen genel ad."
"better, improve, amend, ameliorate, meliorate",to make better,"geliştirmek, düzeltmek, değiştirmek, rötuş etmek, rötuşlamak",daha iyi hale getirmek
shore,the land along the edge of a body of water,"kara, sahil, kıyı, yaka, yalı","Karanın deniz, göl, ırmak boyunca uzanan bölümü"
leave,"go and leave behind, either intentionally or by neglect or forgetfulness",ayrılmak ,"bir kimseden, bir şeyden, bir yerden uzaklaşmak veya (koca ya da karı) evlilik birliğini bozmak, boşanmak"
"price, terms, damage",the amount of money needed to purchase something,"fiyat, ödenek, bedel, eder",Bir mal veya hizmet için uygun görülen para karşılığı.
clay,a very fine-grained soil that is plastic when moist but hard when fired,kil,Islandığı zaman kolayca biçimlendirilebilen yumuşak ve yağlı toprak.
worm,any of numerous relatively small elongated soft-bodied animals especially of the phyla Annelida and Chaetognatha and Nematoda and Nemertea and Platyhelminthes; also many insect larvae,"solucan, kurt, kurtçuk",omurgasız yassı canlı
"pine, pine tree, true pine",a coniferous tree,"çam, çam ağacı","Çamgillerin örnek bitkisi olan, dört mevsim yeşil kalabilen, iğne yapraklı, yurdumuzda birçok türü yetişen bir orman ağacı (Pinus), "
"commercial enterprise, business enterprise, business",the activity of providing goods and services involving financial and commercial and industrial aspects,"iktisadi işletme, ticari şirket, ticari işletme","Tarım, sanayi, ticaret, bankacılık vb. iş alanlarında, kâr amacıyla bir sermaye yatırılarak kurulan kurum."
"decay, crumble, delapidate",fall into decay or ruin,"çürümek, ufalanmak, parçalanmak, harap olmak, çökmek, yıpranmak","Sağlamlığını, dayanıklılığını yitirmek."
sky,the atmosphere and outer space as viewed from the earth,gökyüzü,Atmosferin gözle görünen bölümü
"decompose, rot, molder, moulder",break down,"bozulmak, çürümek","(canlı ve cansız bütün nesneler için) eskime, bayatlama, yıpranma vb. gibi türlü doğal etkilerle ve en çok da mikropların etkisiyle, kimyasal değişikliğe uğrayarak bozulup dağılmak ya da kokuşmak."
"bite, seize with teeth","to grip, cut off, or tear with or as if with the teeth or jaws","ısırmak, parçalamak, koparmak,kemirmek","Dişleri arasına alıp sıkmak, koparmak"
"sister, sis",a female person who has the same parents as another person,,
press,exert pressure or force to or upon,"bastırmak, basmak",Bir şeyi üzerine kuvvet vererek itmek
"pull, draw, force",cause to move by pulling,"çekmek, asılmak",Bir şeyi tutup kendine veya başka bir yöne doğru yürütmek.
right,being or located on or directed toward the side of the body to the east when facing north,sağ,"Vücutta kalbin bulunduğu tarafın karşısında olan, sol karşıtı."
"transport, carry","move while supporting, either in a vehicle or in one's hands or on one's body","taşımak, götürmek, ulaştırmak",Bir şeyi bir yerden alıp başka bir yere götürmek
spark,a small fragment of a burning substance thrown out by burning material or by friction,kıvılcım,"Yanmakta olan bir maddeden sıçrayan küçük ateş parçası; çakım, çakın, çıngı, şerare."
sweet,having or denoting the characteristic taste of sugar,tatlı,Şeker tadında olan.
"nose, olfactory organ",the organ of smell and entrance to the respiratory tract; the prominent part of the face of man or other mammals,burun,"Alınla üst dudak arasında bulunan, çıkıntılı, iki delikli koklama ve solunum organı; koku alma organı."
left,being or located on or directed toward the side of the body to the west when facing north,sol,"Vücutta kalbin bulunduğu tarafta olan, sağ karşıtı."
sour,having a sharp biting taste,ekşi,Sirke veya limon tadında olan.
"spring, fountain, outflow, outpouring, natural spring",a natural flow of ground water,"kaynak, pınar, doğal kaynak, kaynak suyu",Bir suyun çıktığı yer
"pluck, plunk, pick",pull lightly but sharply with a plucking motion,GAP,
"chin, mentum",the protruding part of the lower jaw,çene,"Canlılarda baş bölümünde yer alan, kemik veya kıkırdak ile desteklenen, altlı üstlü dişleri taşıyan ve ağzın kapanıp açılmasını sağlayan kasları üzerinde barındıran iki parçaya verilen ad."
star,any celestial body visible (as a point of light) from the Earth at night,yıldız,"Çekirdeğinde oluşan füzyon sonucunda açığa çıkan enerjiyi uzaya ışınım biçiminde yayan, ışıklı gök cisimlerinden her biri."
force,a powerful effect or influence,"etki, tesir",Bir kimse veya nesnenin başka bir kişi veya şey üzerindeki etkileme gücü
"face, human face",the front of the human head from the forehead to the chin and ear to ear,"yüz, surat","Başta, alın, göz, burun, ağız, yanak ve çenenin bulunduğu ön bölüm."
"push, force",move with force,"itmek, ittirmek",Bir şeyi güç uygulayarak ileri götürmek
"lug, tote, tug",carry with difficulty,GAP,
read,interpret something that is written or printed,okumak,"Bir metni sadece harf ve işaretlere bakıp anlamak, metni seslendirmek veya yazılmış bir metnin iletmek istediği şeyleri öğrenmek."
"conserve, preserve, maintain, keep up","keep in safety and protect from harm, decay, loss, or destruction","korumak, muhafaza etmek, bakmak, ilgilenmek","Bir şeyin eskimesini, yıpranmasını önlemek için gereken dikkat ve özeni göstermek"
"brow, forehead",the part of the face above the eyes,alın,"üzün, kaşlarla saçlar arasındaki bölümü."
cheek,either side of the face below the eyes,yanak,"Yüzün göz, kulak ve burun arasındaki bölümü."
"dry, dry out",become dry or drier,kurumak,"slaklığını, nemini yitirerek kuru duruma gelmek."
sun,a typical star that is the source of light and heat for the planets in the solar system,güneş,"Dünyanın da içinde bulunduğu Güneş sistemindeki gezegenlerin merkezinde yer alan, ısı ve ışık kaynağı büyük gök cismi."
"fir, fir tree, true fir",any of various evergreen trees of the genus Abies; chiefly of upland areas,"köknar, göknar, köknar ağacı, göknar ağacı","Çamgillerden, yüksek bölgelerde yetişen, iğne yaprakları kısa, yassı olan, reçineli ve kozalaklı bir orman ağacı."
"rock, sway, shake",move back and forth  or sideways,"sarsılmak, sallanmak",Birdenbire ve güçle kımıldamak.
"think, cogitate, cerebrate","use or exercise the mind or one's power of reason in order to make inferences, decisions, or arrive at a solution or judgments","düşünmek, kafa yormak, kafayı çalıştırmak, tasarlamak","Bir sonuca varmak amacıyla bilgileri incelemek, karşılaştırmak ve aradaki ilgilerden yararlanarak düşünce üretmek, zihinsel yetiler oluşturmak; muhakeme etmek."
"rock, sway",cause to move back and forth,"sarsmak, sallamak",Birdenbire ve güçle kıpırdatmak.
"round, circular",having a circular shape,yuvarlak,Top veya küre biçiminde olan.
"between, 'tween",in between,"arasında, arada"," İki şeyin ya da iki noktanın ortasında, bunlar arasında kalan mesafede veya konumda."
"find, regain",come upon after searching; find the location of something that was missed or lost,"bulmak, kavuşmak",Kaybedilen bir şeyi yeniden ele geçirmek.
"swamp, swampland",low land that is seasonally flooded; has more woody plants than a marsh and better drainage than a bog,bataklık,Çok derin olmayan sularla örtülü batak bölge.
chair,"a seat for one person, with a support for the back",sandalye,"Arkalıklı, kol koyacak yerleri olmayan, bir kişilik oturma eşyası."
familiar,well known or easily recognized,tanıdık,"Daha önceden bilinen, görülen, aşina olunan"
"history, account, chronicle, story",a record or narrative description of past events,"geçmiş, tarih, günlük",Bugüne göre geride kalmış olan zaman.
"mind, head, brain, psyche, nous",that which is responsible for one's thoughts and feelings; the seat of the faculty of reason,"akıl, zihin","Düşünme, anlama ve kavrama gücü."
"walk, take the air",take a walk; go for a walk; walk for pleasure,"yürümek, hava almak","Adım atarak ilerlemek, gitmek."
"calculate, cipher, cypher, compute, work out, reckon, figure",make a mathematical calculation or computation,hesaplamak,"Hesap işlemini yapmak, hesap etmek."
tea,a beverage made by steeping tea leaves in water,çay,Bu yaprağın demlenmesiyle elde edilen güzel kokulu ve sarımtırak kırmızı renkli içecek.
"floor, flooring",the inside lower horizontal surface (as of a room or hallway),"zemin, taban, yer","Üstü kapalı bir yerin gezinilen, ayakla basılan yüzü"
trail,a track or mark left by something that has passed,iz,Bir şeyin geçtiği veya önce bulunduğu yerde bıraktığı belirti.
"health, wellness",a healthy state of wellbeing free from disease,"sağlık, sıhhat","Bireyin fiziksel, sosyal ve ruhsal yönden tam bir iyilik durumunda olması, vücut esenliği."
