74340,Shade_74339 ,NOUN,shadow,bayangan,,shade within clear boundaries,area taduh nang babatas,,,"bayangan awak, bayangan pohon, jangan meumbai bayangan",,
38639,Request_38610 ,NOUN,call,panggilan,,a request,sebuah permintaan,,"""many calls for Christmas stories""; ""not many calls for buggywhips""","""banyak dapat panggilan beulah wadai pas natal""",,
49618,Opening_49999 ,NOUN,hole,lubang,,an opening into or through something,bukaan ke dalam atau melalui sesuatu,,,menggali lubang hagan betanam padi,,
74351,Emotional state_74346 ,NOUN,"happiness, felicity",arai,,state of well-being characterized by emotions ranging from contentment to intense joy,keadaan sanang nang ditandai lawan emosi dari kepuasan sampai kegembiraan nang luar biasa,,,kearaian melihat kuitan datang,,
9605,Aquatic bird_9525 ,NOUN,swan,angsa,,stately heavy-bodied aquatic bird with very long neck and usually white plumage as adult,"burung banyu yang kada bisa tarabang, beawak ganal, gulu panjang, dan babulu warna putih ",,,angsa manyasah mun malihat orang lewat dihadapannya,,
62074,Precipitation_62002 ,NOUN,"snow, snowfall","salju, hujan salju",,precipitation falling from clouds in the form of ice crystals,hujan nang gugur dari awan berbentuk gumpalan es serut,,,curah salju,,
34408,Publication_35306 ,NOUN,book,buku,,a written work or composition that has been published (printed on pages bound together),"kartas nang bajilit, ada tulisan atau kusung",,"""I am reading a good book on economics""",mambaca buku ekonomi ,,
49684,Land_49761 ,NOUN,island,pulau,,a land mass (smaller than a continent) that is surrounded by water,"daratan, lebih halus dari benua, di kaliligi banyu",,,pulau bakut,,
54676,Spouse_57259 ,NOUN,"husband, hubby, married man",laki,,a married man; a woman's partner in marriage,"lakian nang sudah babini, laki urang",,,balaki,,
28256,Extent_28232 ,NOUN,"area, expanse, surface area","luas, parmukaan",,the extent of a 2-dimensional surface enclosed within a boundary,luas parmukaan 2 diminsi yang tatutup dalam suatu batas,,"""the area of a rectangle""; ""it was about 500 square feet in area""","""luas parsagi panjang""; ""luasnya sakitar 500 kaki parsagi""",,
40742,Nutriment_40724 ,NOUN,"meal, repast","makan, manyurung",,the food served and eaten at one time,makanan disurung dan dimakan basamaan,,,basasurung makanan,,
28259,Dimension_28082 Physical property_27656 Fundamental quantity_72017 ,NOUN,length,panjang,,the linear extent in space from one end to the other; the longest horizontal dimension of something that is fixed in place,bajarak jauh dari ujung ka ujung,,"""the length of the table was 5 feet""","kapanjangan, panjang banar",,
28260,Size_28114 ,NOUN,"distance, length",jarak,,size of the gap between two places,jarak antara dua tampat,,"""the distance from New York to Chicago""; ""he determined the length of the shortest line segment joining the two points""",bajarak,,
30311,External body part_28727 ,NOUN,"head, caput",kapala,,the upper part of the human body or the front part of the body in animals; contains the face and brains,awak bagian atas manusia,,"""he stuck his head out the window""","bakapala, manyatuk kapala",,
49734,Body of water_49198 Stagnant body of water_118043 ,NOUN,lake,danau,,a body of (usually fresh) water surrounded by land,awak banyu nang dikalilingi daratan,,,danau seran tampat liburan,,
78499,Residue_79868 ,NOUN,ash,habu,,the residue that remains when something is burned,sisa yang tatinggal imbah dibakar,,,"habu kayu, maroko habunya tarabang",,
49762,Object_108 ,NOUN,"land, ground, soil",tanah,,material in the top layer of the surface of the earth in which plants can grow (especially with reference to its quality or use),parmukaan bumi atau lapisan bumi nang manjadi tampat tumbuhnya tanaman,,"""the land had never been plowed""; ""good agricultural soil""","tanah bahuma, jangan katanah",,
20007,Restraint_22502 ,NOUN,"leash, tether, lead",tali,,restraint consisting of a rope (or light chain) used to restrain an animal,tali gasan maikat hiwan,,,manalii warik supaya kada lapas,,
30350,Bone_28964 ,NOUN,jaw,wihang,,the part of the skull of a vertebrate that frames the mouth and holds the teeth,bagian tengkorak nang membingkai muntung gasan menahan gigi.,,,,,
28302,Dimension_28082 ,NOUN,"height, tallness",tinggi ,,the vertical dimension of extension; distance from the base of something to the top,"batinggi, batambah jarak dari bawah sampai ka atas.",,,,,
49827,Land_49761 ,NOUN,mainland,daratan,,the main land mass of a country or continent; as distinguished from an island or peninsula,daratan utama nang membatasi nagara atawa banua,,,,,
30353,External body part_28727 ,NOUN,"neck, cervix",gulu,,the part of an organism that connects the head to the rest of the body,bagian awak nang menghubungkan kapala lawan awak.,,"""he admired her long graceful neck""",Inya katuju lawan gulunya nang langkar.,,
30357,Rear_46449 ,NOUN,"nape, scruff, nucha",puhun gulu,,the back side of the neck,bagian balakang gulu.,,,,,
30358,Tubular cavity_30364 ,NOUN,"throat, pharynx",rakungan,,the passage to the stomach and lungs; in the front part of the neck below the chin and above the collarbone,"saluran nang manuju lambung lawan paru-paru, andakannya di muka gulu, di bawah dagu, lawan tulang salangka.",,,,,
24176,Supporting structure_24179 ,NOUN,support,panopang atawa dasar.,,supporting structure that holds up or provides a foundation,manahan atawa manyadiakan pondasi.,,"""the statue stood on a marble support""",patung ngintu badiri di atas panopang marmer.,,
70345,Acquisition_70279 ,NOUN,gift,hadiah,,something acquired without compensation,di dapatakan tapi kada baharap imbalan.,,,,,
40800,Dish_40660 ,NOUN,soup,sup,,liquid food especially of meat or fish or vegetable stock often containing pieces of solid food,"makanan nang bakuah, biasanya ada daging lawan tatakan sayur.",,,,,
30365,Body part_28710 ,NOUN,shoulder,bahu,,the part of the body between the neck and the upper arm,bagian awak yang andakannya di antara gulu lawan langan atas.,,,,,
17971,Artifact_124 ,NOUN,"fabric, cloth, material, textile",kain,,artifact made by weaving or felting or knitting or crocheting natural or synthetic fibers,di ulah malalui rajut atawa manyusun.,,"""the fabric in the curtains was light and semitransparent""; ""woven cloth originated in Mesopotamia around 5000 BC""; ""she measured off enough material for a dress""",Inya mangukur bahan nang cukup gasan baulah gaun.,,
28328,Good_28327 ,NOUN,"benefit, welfare",harakat ,,something that aids or promotes well-being,sasuatu nang mandukung kasajahtraan.,,"""for the common good""",gasan kapantingan barataan.,,
62171,Atmospheric phenomenon_61634 ,NOUN,"weather, weather condition, atmospheric condition",cuaca,,the meteorological conditions: temperature and wind and clouds and precipitation,"kondisi suhu, angin, lawan curah hujan.",,"""they were hoping for good weather""; ""every day we have weather conditions and yesterday was no exception""",buhannya baharap cuaca bagus haja.,,
20056,Top_24730 ,NOUN,lid,tudung,,a movable top or cover (hinged or separate) for closing the opening of a container,gasan manutup wadah.,,,,,
62176,Weather_62171 ,NOUN,"wind, air current, current of air","angin, arus udara, arus udara",,air moving (sometimes with considerable force) from an area of high pressure to an area of low pressure,udara nang bapindah (kadang lawan gaya nang ganal) dari wadah tekanan tinggi ke wadah tekanan randah,,"""trees bent under the fierce winds""; ""when there is no wind, row""; ""the radioactivity was being swept upwards by the air current and out into the atmosphere""","""pepohonan membungkuk di bawah angin laju""; bila kadada angin bebaris""; ""radioaktivitas tesapu ke atas oleh arus udara lawan kaluar ke atmosfer""",,
30383,Body part_28710 ,NOUN,"thorax, chest, pectus","dada, dada, pektus",,the part of the human torso between the neck and the diaphragm or the corresponding part in other vertebrates,bagian awak manusia antara gulu lawan diafragma atau bagian nang sasuai pada vetebrata lainnya,,,dada inya luka dicakar kucing,,
15921,Headdress_19118 ,NOUN,cap,topi,,a tight-fitting headdress,panutup kepala nang pas banar,,,topi inya liwar ganal ,,
49894,Plain_50070 ,NOUN,"moor, moorland",GAP,,open land usually with peaty soil covered with heather and bracken and moss,,,,,,
30392,Mammary gland_30391 ,NOUN,"breast, bosom, knocker, boob, tit, titty",payudara,,either of two soft fleshy milk-secreting glandular organs on the chest of a woman,salah satu dari dua organ lunak yang mangaluarkan susu dan berdaging di dada binian,,,,,
49901,Continental elevation_118025 Natural elevation_49932 ,NOUN,"mountain, mount",gunung,,a land mass that projects well above its surroundings; higher than a hill,sabuah daratan nang manjulang tinggi di atas lingkungannya; labih tinggi dari sabuah bukit,,,"gunung ganal itu hanyar meletus tahun ini, setelah sekian lama ",,
30406,Point_46401 ,NOUN,"navel, umbilicus, bellybutton, omphalos, omphalus",pusar,,scar where the umbilical cord was attached,bakas luka di wadah tali pusar dipasang,,,,,
7696,Vertebrate_7533 ,NOUN,bird,burung,,warm-blooded egg-laying vertebrates characterized by feathers and forelimbs modified as wings,vertebrata beintalu berdarah panas yang beciri oleh bulu lawan batis muka nang dimodifikasi jadi sayap,,,bulu burung itu bagus banar; burung ganal itu mencari mangsa,,
30407,Body part_28710 ,NOUN,"abdomen, venter, stomach, belly","parut, lubang angin, parur, parut",,the region of the body of a vertebrate between the thorax and the pelvis,bagian awak vertebrata antara dada lawan panggul,,,parut inya sakit habis dihantam lawan bola,,
49932,Geological formation_49530 ,NOUN,"natural elevation, elevation","katinggian alami, katinggian",,a raised or elevated geological formation,formasi geoglogis nang ditinggikan,,,,,
30415,Body part_28710 ,NOUN,"back, dorsum",punggung,,the posterior part of a human (or animal) body from the neck to the end of the spine,bagian balakang manusia atau hewan mulai gulu sampai hujung tulang balakng,,"""his back was nicely tanned""",punggung inya bewarna kecoklatan,,
49945,Natural object_121 ,NOUN,nest,sarang,,a structure in which animals lay eggs or give birth to their young,sabuah wadah gasan hewan beintalu atau melahirkan anak buhannya,,,"sarang burung, sarang buaya ",,
30425,Limb_30421 ,NOUN,leg,batis,,a structure in animals that is similar to a human leg and used for locomotion,susunan pada binatang nang mirip batis manusia lawan dipakai gasan begarak,,,batisnya panjang banar,,
30430,Limb_30421 ,NOUN,thigh,paha,,the part of the leg between the hip and the knee,bagian batis antara pinggul lawan lintuhut,,,pangkal paha,,
38810,Narrative_38803 ,NOUN,"fairytale, fairy tale, fairy story",aandi,,a story about fairies; told to amuse children,kisah peri gasan kakanakan,,,maaandi gasan kakanakan pas handak guring,,
9772,Body covering_28788 ,NOUN,"hide, pelt, skin",kulimbit,,body covering of a living animal,panutup awak binatang hidup,,,"kulimbit ayam dimasaki, mancabuti bulu ayam",,
30435,Vertebrate foot_30434 ,NOUN,"foot, human foot, pes",batis,,the part of the leg of a human being below the ankle joint,bagian batis manusia di bawah buku lali,,"""his bare feet projected from his trousers""; ""armored from head to foot""",singkalan batis,,
30436,Limb_30421 ,NOUN,arm,pagalangan,,a human limb; technically the part of the superior limb between the shoulder and the elbow but commonly used to refer to the whole superior limb,bagian awak manusia mulai dari bahu sampai siku,,,ganalnya pagalangan,,
9774,Body covering_28788 Animal material_78407 ,NOUN,"feather, plume, plumage","bulu, bulu-bulu, bulu burung ",,the light horny waterproof structure forming the external covering of birds,benda tahan banyu yang manutupi burung,,,tarabangan bulu burung,,
15972,Merchandise_20557 ,NOUN,"cargo, lading, freight, load, loading, payload, shipment, consignment","paangkutan, angkutan, pangiriman",,goods carried by a large vehicle,barang yang dibawa kandaraan ganal,,,"paangkutan lamari, pangiriman barang",,
30439,Extremity_30449 ,NOUN,"hand, manus, mitt, paw","pagalangan, kaus tangan, talapak batis",,the (prehensile) extremity of the superior limb,hujung yang dapat manjapai bagian awak atas,,"""he had the hands of a surgeon""; ""he extended his mitt""","kaus tangan warna habang, talapak batis pacahan",,
30444,Area_28713 ,NOUN,"palm, thenar",talapak tangan,,the inner surface of the hand from the wrist to the base of the fingers,bagian dalam tangan mulai pagalangan tangan sampai hujung jari,,,talapak tangannya barasih,,
49999,Space_73960 ,NOUN,"opening, gap","tabuka, halapat",,an open or empty space in or between things,bagian tabuka atau kusung di antara dua banda,,"""there was a small opening between the trees""; ""the explosion made a gap in the wall""","tabuka lawang, lantainya bahalapat",,
30448,Digit_30446 Extremity_30449 ,NOUN,finger,jariji,,any of the terminal members of the hand (sometimes excepting the thumb),bagian hujung tangan,,"""her fingers were long and thin""",jarijinya panjang,,
18055,Barrier_14949 ,NOUN,"fence, fencing","pagar, pagar",,a barrier that serves to enclose an area,panghalang gasan manutupi lahan,,,rumahnya pagar putih,,
80716,Time unit_80715 ,NOUN,"day, twenty-four hours, twenty-four hour period, 24-hour interval, solar day, mean solar day","hari, dua puluh ampat jam, _",,time for Earth to make a complete rotation on its axis,pas bumi baputar sacara penuh pada porosnya,,"""two days later they left""; ""they put on two performances every day""; ""there are 30,000 passengers per day""","hari ini libur, waktunya dua puluh ampat jam haja",,
50032,Thing_104 ,NOUN,"part, piece","bagian, kapingan",,a portion of a natural object,bagian atau kapingan dari banda alami,,"""they analyzed the river into three parts""; ""he needed a piece of granite""",ubat nyamuk sakapingan,,
52779,Sibling_57005 Male sibling_55220 ,NOUN,"brother, blood brother","dangsanak lakian, dangsanak sadarah",,a male with the same parents as someone else,lakian yang baisi kuitan yang sama lawan urang lain,,"""my brother still lives with our parents""","dangsanak lakian datang, baisi dangsanak sadarah dua ikung",,
24281,Furniture_18530 ,NOUN,table,meja/mija,,a piece of furniture having a smooth flat top that is usually supported by one or more vertical legs,alat atawa piranti yang biasa dipakai gasan nahan barang,,"""it was a sturdy table""",mija kayu,,
74549,Physiological state_74595 ,NOUN,"sleep, slumber",guring,,a natural and periodic state of rest during which consciousness of the world is suspended,urang baistirahat dengan bapijim,,"""he didn't get enough sleep last night""; ""calm as a child in dreamless slumber""","guring ayam, guringan, kaguringan",,
50067,Hole_49619 ,NOUN,"pit, cavity","lubang, garonggang",,a sizeable hole (usually in the ground),gorongga di paatasan,,"""they dug a pit to bury the body""","garonggang, garunggung",,
5536,Activity_2094 ,NOUN,laughter,tatawa,,the activity of laughing; the manifestation of joy or mirth or scorn,pas marasa lucu,,"""he enjoyed the laughter of the crowd""","tatawaan, batawaan, manawai",,
30487,Hinge joint_30526 ,NOUN,"knee, knee joint, human knee, articulatio genus, genu",dungkul,,hinge joint in the human leg connecting the tibia and fibula with the femur and protected in front by the patella,antara paha dan batis,,,tupi dungkul,,
50094,Cliff_49314 ,NOUN,precipice,jurang,,a very steep cliff,wadah yang curam,,,jurang tinggi,,
1435,Travel_1501 ,NOUN,walk,jalan,,the act of walking somewhere,bamaju atau bamundur,,"""he took a walk after lunch""",bajalanan,,
80757,Rest day_80602 ,NOUN,"sunday, lord's day, dominicus, sun",ahad,,first day of the week; observed as a day of rest and worship by most Christians,"sabalum hari sanayan, sahabis hari sabat",,,hari ahad,,
80759,Weekday_80755 ,NOUN,"tuesday, tues",salasa,,the third day of the week; the second working day,sahabis hari sanayan,,,hari salasa,,
80758,Weekday_80755 ,NOUN,"monday, mon",sanayan,,the second day of the week; the first working day,sabalum hari salasa,,,hari sanayan,,
80761,Weekday_80755 ,NOUN,"thursday, th",hamis,,the fifth day of the week; the fourth working day,sahabis hari arba,,,hari arba,,
80760,Weekday_80755 ,NOUN,"wednesday, midweek, wed",arba,,the fourth day of the week; the third working day,sahabis hari hamis,,,hari hamis,,
20177,Fastener_18034 ,NOUN,lock,"abat, ngkol, kunci",,a fastener fitted to a door or drawer to keep it firmly closed,alan gasan mangunci,,,ngkol inggeris,,
80763,Weekday_80755 ,NOUN,"saturday, sabbatum, sat",sabat,,the seventh and last day of the week; observed as the Sabbath by Jews and some Christians,sahabis hari jumahat,,,hari sabat,,
80762,Weekday_80755 ,NOUN,"friday, fri","jumaat, jumahat",,the sixth day of the week; the fifth working day,sabalum hari sabat,,,hari jumaat,,
80767,Hour_81117 ,NOUN,"noon, twelve noon, high noon, midday, noonday, noontide",siang,,the middle of the day,siang ari,,,"""Siang hari panas banar harinya""",,
80766,Time period_80493 ,NOUN,"morning, morn, morning time, forenoon",baisukan ,,the time period between dawn and noon,"baaisukan, baisukan, saisukan, ",,"""I spent the morning running errands""","""Ulun sudah bagawian baisukan hari""",,
50121,Bow_73881 ,NOUN,rainbow,pelangi ,,an arc of colored light in the sky caused by refraction of the sun's rays by rain,pelangi,,,"""Pelangi itu timbul imbah hujan""",,
30509,Digit_30446 Extremity_30449 ,NOUN,toe,batis,,one of the digits of the foot,jari batis,,,"""Jari batisnya luka karena tahantup lawang""",,
80774,Day_80765 ,NOUN,"evening, eve, even, eventide","kamarian, sanja, parak kadap",,the latter part of the day (the period of decreasing daylight from late afternoon until nightfall),"basanjaan hari, parak kadap, kamarian, kesorean",,"""he enjoyed the evening light across the lake""","""Inya mamandangi cahaya malam di subarang danau""",,
80777,Time period_80493 ,NOUN,"night, nighttime, dark",malam,,the time after sunset and before sunrise while it is dark outside,malam ari,,,"""Malam ari nih dingin banar mun kada bejaket""",,
30514,Skeletal structure_30554 ,NOUN,heel,tumit,,the back part of the human foot,tumit batis,,,"""Tumit batis luka karna tajajak paku""",,
54896,Sovereign_57195 ,NOUN,"king, male monarch, rex","raja, sultan",,a male sovereign; ruler of a kingdom,"raja, sultan, pagustian, padatuan. ",,,"""Raja itu menikahi gadis desa""",,
30524,Hinge joint_30526 ,NOUN,"elbow, elbow joint, human elbow, cubitus, cubital joint, articulatio cubiti",siku ,,hinge joint between the forearm and upper arm and the corresponding joint in the forelimb of a quadruped,siku tangan,,,"""Siku tangannya lingsak imbau tagugur""",,
38905,Speech act_38481 ,NOUN,"address, speech","alamat, pidato",,the act of delivering a formal spoken communication to an audience,bapidato,,"""he listened to an address on minor Roman poets""","""Inya mandangari pidatu panyair romawi""",,
50149,Object_108 ,NOUN,"ribbon, thread",pita,,any long object resembling a thin line,bapita,,"""a mere ribbon of land""; ""the lighted ribbon of traffic""; ""from the air the road was a grey thread""; ""a thread of smoke climbed upward""","sapitak tanah, baju bapita, kotak bapita, ",,
80795,Time period_80493 ,NOUN,"week, hebdomad",ahad,,any period of seven consecutive days,saminggu,,"""it rained for a week""",samingguan hujan,,
30532,Horny structure_30531 ,NOUN,nail,kuku,,horny plate covering and protecting part of the dorsal surface of the digits,kuku jari,,,"""Kuku jarinya tapacul karena tahantup tunggul""",,
74619,Drive_74596 ,NOUN,"hunger, hungriness",lapar,,a physiological need for food; the consequence of food deprivation,kalaparan,,,"""Imbah bulik begawi langsung makan karena kelaparan""",,
50163,Stream_50345 ,NOUN,river,batang banyu,,a large natural stream of water (larger than a creek),aliran banyu alami nang ganal (labih ganal dari sungai),,"""the river was navigable for 50 miles""",“batang banyu ngini kawa dilalui sapanjang 50 mil”,,
50168,Natural object_121 ,NOUN,"rock, stone",batu,,a lump or mass of hard consolidated mineral matter,gumpalan atawa massa dari bahan mineral nang tapadat,,"""he threw a rock at me""",“inya menimbai batu kayah aku.”,,
30546,Nail_30532 ,NOUN,fingernail,"kuku jariji, kuku",,the nail at the end of a finger,kuku nang di hujung jari,,,"“tampuluh hari Jumahat, handak kutatak kuku nih.”",,
50226,Body of water_49198 ,NOUN,sea,laut,,a division of an ocean or a large body of salt water partially enclosed by land,sabuah divisi lautan atawa sabuah awak banyu masin nang tahalus ulih daratan,,,“tulak inya balayar ka laut”,,
50231,Shore_50261 ,NOUN,"seashore, coast, seacoast, sea-coast",pinggir laut/pantai,,the shore of a sea or ocean,pinggir laut atawa samudera,,,“umbaknya bajalan ka pinggir pantai”,,
11958,Lepidopterous insect_11957 ,NOUN,butterfly,rama-rama,,diurnal insect typically having a slender body with knobbed antennae and broad colorful wings,serangga diumal biasanya baisi awak langsing lawan antena mancungul wan sayap lebar bawarna-warni,,,“bungasnya rama-rama ngini”,,
50261,Geological formation_49530 ,NOUN,shore,bagian darat/darat/pinggir banyu pantai,,the land along the edge of a body of water,tanah di sapanjang pinggir banyu pantai,,,"“bakudakan kami di pinggir banyu pantai""",,
70571,Cost_70407 ,NOUN,"price, terms, damage","haraga, sambatan, karusakan",,the amount of money needed to purchase something,jumlah duit nang diparluakan gasan batatukar,,"""the price of gasoline""; ""he got his new car on excellent terms""; ""how much is the damage?""","“Haraga bensin"", “Inya mandapatakan mobil hanyarnya nang bagus banar”, “barapa karusakannya?”",,
78766,Soil_78939 ,NOUN,clay,tanah liat,,a very fine-grained soil that is plastic when moist but hard when fired,tanah babutir halus banar nang basipat plastik pas basah tapi karing pas dipanasakan,,,"“tanah liat tu kawa diulah andakan kambang,”",,
9925,Invertebrate_9836 ,NOUN,worm,hulat cacing,,any of numerous relatively small elongated soft-bodied animals especially of the phyla Annelida and Chaetognatha and Nematoda and Nemertea and Platyhelminthes; also many insect larvae,binatang babantuk lunak nang relatif halus wan bapanjang tautama matan filum annelida wan chaetognatha wan nematoda wan nemertea wan platyhelminthes; jua banyak mamasukakan larva,,,hulat cacing rancak kutamui di bawah ember”,,
62383,Conifer_69565 ,NOUN,"pine, pine tree, true pine","pinus, puhun pinus, bujuran pinus",,a coniferous tree,pohon nang jenis konifera,,,“tingginya puhun pinus tu”,,
5639,Commerce_5625 ,NOUN,"commercial enterprise, business enterprise, business","usaha bajualan, bisnis",,the activity of providing goods and services involving financial and commercial and industrial aspects,"kagiatan manyadiakan barang wan jasa nang malibatakan aspék kauangan, komersial, wan industri",,"""computers are now widely used in business""",“komputer wahini banyak dipakai dalam bisnis”,,
50281,Atmosphere_49121 ,NOUN,sky,langit,,the atmosphere and outer space as viewed from the earth,atmosfer wan luar angkasa amun dilihat matan bumi,,,“mamandang langit sanja”,,
57043,Sibling_57005 Female sibling_53978 ,NOUN,"sister, sis",dingsanak binian,,a female person who has the same parents as another person,dingsanak binian sakuitan/sama kuitannya,,"""my sister married a musician""",“dingsanak binianku kawin wan urang musik/musisi”,,
50311,Fragment_49515 ,NOUN,spark,perancingan,,a small fragment of a burning substance thrown out by burning material or by friction,pecahan halus matan zat nang tabakar dibuang malalui bahan nang tabakar atawa malalui gesekan,,,“inya malap parancingan banyu babasuh piring”,,
30614,Chemoreceptor_29117 ,NOUN,"nose, olfactory organ","idung, bagian awak nang mancium bau",,the organ of smell and entrance to the respiratory tract; the prominent part of the face of man or other mammals,"organ gasan masuk saluran napas wan mancium bau, bagian muha manusia atau mamalia lain nang menonjol",,"""he has a cold in the nose""",“inya flu/baingusan idungnya”,,
50318,Natural flowing body of water_118044 Geological formation_49530 ,NOUN,"spring, fountain, outflow, outpouring, natural spring",banyu,,a natural flow of ground water,babanyuan,,,banyak banar banyu di ember,,
30622,Feature_30633 ,NOUN,"chin, mentum",dagu,,the protruding part of the lower jaw,dagu ,,,sakit banar daguku ,,
50323,Celestial body_49276 ,NOUN,star,bintang,,any celestial body visible (as a point of light) from the Earth at night,"bulan, bintang",,,bisa banyak banar bulan lawan bintang malam isuk,,
28581,Influence_28579 ,NOUN,force,pamaksaan,,a powerful effect or influence,tapaksa,,"""the force of his eloquence easily persuaded them""",aku tapaksa maumpati kahandaknya,,
30629,External body part_28727 ,NOUN,"face, human face",muha,,the front of the human head from the forehead to the chin and ear to ear,muha sabijian,,"""he washed his face""; ""I wish I had seen the look on his face when he got the news""",mambasuh muha di banyu,,
30636,Feature_30633 ,NOUN,"brow, forehead","kaning, dahi",,the part of the face above the eyes,"kaning, dahi",,,dahiku luka sadikit lagi kana kaningku,,
30638,Feature_30633 ,NOUN,cheek,pipi,,either side of the face below the eyes,muha pipi,,,lamak banar Muha pipi kam ,,
50355,Star_50322 ,NOUN,sun,matahari,,a typical star that is the source of light and heat for the planets in the solar system,matahari manggantang,,"""the sun contains 99.85% of the mass in the solar system""","matahari liwar Parak banar, panas ",,
62442,Conifer_69565 ,NOUN,"fir, fir tree, true fir",GAP,,any of various evergreen trees of the genus Abies; chiefly of upland areas,,,,,,
50367,Wetland_50509 ,NOUN,"swamp, swampland",tanah rawa,,low land that is seasonally flooded; has more woody plants than a marsh and better drainage than a bog,tanah rawa pahumaan,,,tanah pahumaan liwar suburnya,,
