100617,Change state_101049 ,VERB,"dress, clothe, enclothe, garb, raiment, tog, garment, habilitate, fit out, apparel",babaju,,provide with clothes or put clothes on,mamakai baju,,"""Parents must feed and dress their child""","""galuh mamakai baju warna habang""",,
110864,,VERB,"notice, mark, note",majanaki,,notice or perceive,manjanaki urang,,"""She noted that someone was following her""; ""mark my words""",“manjanaki tarus”,,
100630,Dress_100610 ,VERB,"wear, put on, get into, don, assume",memakai baju,,put clothing on one's body,mamakai baju ,,"""What should I wear today?""; ""He put on his best suit for the wedding""; ""The princess donned a long blue dress""; ""The queen assumed the stately robes""; ""He got into his jeans""","""mamakai baju haja liwar ngalih""",,
100629,Undress_100627 ,VERB,take off,mamacul baju,,remove clothes,mamacul ka baju,,"""take off your shirt--it's very hot in here""","""sini nah mamacul akan baju""",,
104725,Complain_104716 ,VERB,"murmur, mutter, grumble, croak, gnarl",bagarunum,,make complaining remarks or noises under one's breath,bapandir gimit,,"""she grumbles when she feels overworked""","""bagarunum tarus acil ngitu""",,
110873,Ache_110882 ,VERB,"bite, sting, burn",tacucuk,,cause a sharp or stinging pain or discomfort,kasakitan,,"""The sun burned his face""","""tacucuk aku sakit banar""",,
106780,Rub_106441 ,VERB,"scrape, grate",gegatalan,,scratch repeatedly,kagatalan,,"""The cat scraped at the armchair""","""liwar gagatalannya awakku""",,
108828,Move_109413 ,VERB,"dance, trip the light fantastic, trip the light fantastic toe",bajoget,,move in a pattern; usually to musical accompaniment; do or perform a dance,bajoget saawakan,,"""My husband and I like to dance at home to the radio""","""mandangar musik haja timbul bajoget""",,
106786,Remove_101174 ,VERB,"dig, delve, cut into, turn over",manabuk,,"turn up, loosen, or remove earth",manabuk lubang,,"""Dig we must""; ""turn over the soil for aeration""","""manabuk lubang sing dalaman""",,
110882,Cause to be perceived_110891 ,VERB,"ache, smart, hurt",padih,,be the source of pain,kasakitan banar,,,"""padih parut""",,
104740,Express_104872 ,VERB,"exclaim, cry, cry out, outcry, call out, shout",bakuciak,,"utter aloud; often with surprise, horror, or joy",bakuciak nyaring,,"""`I won!' he exclaimed""; ""`Help!' she cried""; ""`I'm here,' the mother shouted when she saw her child looking lost""","""bakuciak nyaring banar""",,
110896,Perceive_110812 ,VERB,smell,mancium,,inhale the odor of; perceive by the olfactory sense,mancium bau,,,"""mancium ka anak""",,
112945,Save_112949 ,VERB,"rescue, deliver",salamat,,free from harm or evil,manang,,,"""salamat jua sampai tujuan""",,
102717,End_102093 ,VERB,"complete, finish",tuntung,,come or bring to a finish or an end,manuntung akan gawian,,"""He finished the dishes""; ""She completed the requirements for her Master's Degree""; ""The fastest runner finished the race in just over 2 hours; others finished in over 4 hours""","""tuntung sudah gawian""",,
106817,,VERB,"search, seek, look for",mancari,,"try to locate or discover, or try to establish the existence of",mancari nang hilang,,"""The police are searching for clues""; ""They are searching for the missing man in the entire county""","""mancari gawian pulang lah""",,
110916,Perceive_110812 ,VERB,see,malihat,,perceive by sight or have the power to perceive by sight,pakai mata gasan mamandang,,"""You have to be a good observer to see all the details""; ""Can you see the bird in that tree?""; ""He is blind--he cannot see""",“Sidin bapadah kada malihat jar”,,
110921,,VERB,look,cangang,,perceive with attention; direct one's gaze towards,pakai mata gasan malihat nang urang kada kawa lihat,,"""She looked over the expanse of land""; ""Look at your child!""; ""Look--a deer in the backyard!""",“Napa pian cangang-cangang wan ulun?,,
112972,Prevent_112484 ,VERB,"obstruct, blockade, block, hinder, stymie, stymy, embarrass",mahalangi,,hinder or prevent the progress or accomplishment of,urang kada kawa melihati karna ada nang menutupi panglihatan,,"""His brother blocked him at every turn""","“Mahalangi jalan ja nih, kada kawa malihat lagi unda”",,
110933,Be_113205 ,VERB,"look, appear, seem",kaya,,give a certain impression or have a certain outward aspect,panglihatan nang nampak jelas di mata tagal kada tahu bujur kadanya,,"""She seems to be sleeping""; ""This appears to be a very difficult problem""; ""This project looks fishy""; ""They appeared like people who had not eaten or slept for a long time""",“Inya guring kah/ kada kah? kaya kada bakijim”,,
110940,,VERB,sound,suara,,give off a certain sound or sounds,mangaluarkan bunyi di muntung,,"""This record sounds scratchy""",”Suara buhan kam nyaring lalu”,,
104795,Inform_104377 ,VERB,"indicate, point, show",manunjuk,,"indicate a place, direction, person, or thing; either spatially or figuratively","memadahi urang ampah jalan, urang, wan banda, bisa lewat muntung atawa pakai tangan",,"""I showed the customer the glove section""; ""He pointed to the empty parking space""; ""he indicated his opponents""",“Rio manujuk mangga di pohon urang”,,
100713,Express emotion_109270 ,VERB,"cry, weep",manangis,,"shed tears because of sadness, rage, or pain",mangaluarkan banyu di mata,,"""She cried bitterly when she heard the news of his death""; ""The girl in the wheelchair wept with frustration when she could not get up the stairs""",“Manangis banar inya imbah tagugur di jalan”,,
106863,,VERB,kill,mambunuh,,"cause the death of, without intention",sangaja atau kada sangaja mahilangkan nyawa urang atawa binatang,,"""She was killed in the collision of three cars""",“kiki sangaja mambunuh cacak ditawing”,,
104817,Communicate_103972 ,VERB,"convey, impart",mahabari/mangabari,,"make known; pass on, of information",membari tahu habar ke urang lain,,,“Mamanya mahabari tadi si Aluh garing jar”,,
110963,Appear_102425 ,VERB,"show, show up",pina,,be or become visible or noticeable,"kaadaan/sesuatu hal nang kawa dilihat lewat mata, tapi kada tahu bujur kadanya",,"""His good upbringing really shows""; ""The dirty side will show""",“Pina sigar dah inya habis garing samalam”,,
108926,Talk_104880 ,VERB,sing,banyanyi,,produce tones with the voice,managaluarkan suara nang bagus atau banada ,,"""She was singing while she was cooking""; ""My brother sings very well""",“Bagus banar si Intan banyanyi. Saban hari banyanyi tarus”,,
106884,Fasten_106945 ,VERB,"sew, run up, sew together, stitch",manjahit,,fasten by sewing; do needlework,membaiki barang rabit lawan jarum wan banang,,,“Acil manjahit baju nang carik di palatar”,,
110990,,VERB,"hide, conceal",manyilipakan,,prevent from being seen or discovered,kagiatan nang sakiranya urang kada kawa mencarii/menamui,,"""Muslim women hide their faces""; ""hide the money""",“Acil manjahit baju nang carik di palatar”,,
100754,Indispose_100707 ,VERB,"tire, wear upon, tire out, wear, weary, jade, wear out, outwear, wear down, fag out, fag, fatigue",lapah/uyuh,,exhaust or get tired through overuse or great strain or stress,kaadaan habis bagawian nang barat-barat/habis babubakahan,,"""We wore ourselves out on this hike""",“Acil manjahit baju nang carik di palatar”,,
106902,Attach_106711 ,VERB,"glue, paste",malikap,,join or attach with or as if with glue,manempel akan gambar di dinding,,"""paste the sign on the wall""; ""cut and paste the sentence in the text""","“hadang Ma, ulun melikap foto di dinding ni dulu nah”",,
106905,,VERB,cover,pamu’ung,,provide with a covering or cause to be covered,bubungan rumah yang ditutup pakai seng sekira kd kepanasan wan kada kehujanan ,,"""cover her face with a handkerchief""; ""cover the child with a blanket""; ""cover the grave with flowers""","“Ma, lihati pamu’ung rumah kita tu belobang, makanya pas hujan tadi bocor”",,
113057,Victimize_113053 ,VERB,"deceive, lead on, delude, cozen",mandustai  ,,be false to; be dishonest with,bepadah jadi sekalinya kada jadi,,,“Maya tu semalam mendustai aku bepadah jadi tulak sekalinya kada jadi”,,
100771,Suffer_100708 ,VERB,ail,gagaringan ,,"be unwell, ill, or ill disposed",rasa kada nyaman awak tapi balum garing,,,"“aku semalam tu imbah mandi belumba tu awakku asa gegaringan tu, kaya kada nyaman tu”",,
111019,,VERB,watch,manonton ,,look attentively,pakai mata gasan melihat lawan penuh perhatian,,"""watch a basketball game""","“Lia, kena kamarian kita manonton bola di lapangan tu kah?”",,
104904,Determine_104772 ,VERB,"count, number, enumerate, numerate",baitung ,,determine the number or amount of,meitungi jumlah atau nominal,,"""Can you count the books on your shelf?""; ""Count your change""",“isuk kita baitunglah berapa semalam ongkos kita liburan tu”,,
100812,Worsen_101339 ,VERB,"sicken, come down",garing ,,get sick,"awak rasa kada kawa bebangun, makan rasa hanta",,"""She fell sick last Friday, and now she is in the hospital""","“aku semalam imbah mandi malam jumahat, isuk harinya kada kawa babangun lagi, awak panas kaya bara api”",,
111060,Radiate_111064 ,VERB,"flash, blink, wink, twinkle, winkle",kujup-kujup,,gleam or glow intermittently,"lampu nang kena banyala, kena pajah",,"""The lights were flashing""",“lampu di muka warung hamnah tu pina kujup-kujup lampunya”,,
113110,Control_112427 ,VERB,"govern, rule",manyuruh ,,exercise authority over; as of nations,menyuruh urang sekira ada yang digawi,,"""Who is governing the country now?""","“aku semalam lapah banar begawian, si Devin tu aur tahu manyuruh urang ja”",,
106970,,VERB,"close, shut",kantup  ,,move so that an opening or passage is obstructed; make shut,manutup muntung nang haratan benganga,,"""Close the door""; ""shut the window""",“Raihan tu aur bengangaan suruh pang kantup tu”,,
106973,,VERB,"open, open up",takirap ,,cause to open or to become open,barang nang bisa ditampur angin,,"""Mary opened the car door""","“semalam aku mendadai baju tapi kada ingat mengapit, pas bajunya takirap di tampur angin”",,
104929,Inform_104377 ,VERB,"tell, narrate, recount, recite",bakisah ,,narrate or give a detailed account of,memadahi ke urang-urang apa nang dikatahui,,"""Tell what happened""; ""The father told a story to his child""",“kadada yang sanggupnya malawani si Ica tu mun inya sudah bakisah”,,
100840,Better_101345 ,VERB,"recuperate, recover, convalesce",maobati ,,get over an illness or shock,maminum obat gasan meampihi penyakit,,"""The patient is recuperating""","“semalam aku tajuramba, mbah tu disuruh mamaku meobati lawan obat parestamol”",,
102901,Act_112101 ,VERB,"interrupt, disturb",mahaur/manyalang ,,destroy the peace or tranquility of,mengganggu urang bepandir ,,"""Don't interrupt me when I'm reading""",“Si Maya tu mahaur urang lagi bepanderan ja”,,
104956,Denote_104831 ,VERB,"hark back, return, come back, recall","maingatakan, mambulikakan, babulik, maingat-ingat",,go back to something earlier,babulik ka asal,,"""This harks back to a previous remark of his""",Ini maingatakan ujarnya tadi di awal,,
104958,Repeat_104951 ,VERB,"translate, interpret, render","maartii, manafsir, maubah",,restate (words) from one language into another language,manarjamahakan bahasa,,"""I have to translate when my in-laws from Austria visit the U.S.""; ""Can you interpret the speech of the visiting dignitaries?""; ""She rendered the French poem into English""; ""He translates for the U.N.""","""Aku maartii bahasa pas mintuhaku nang dari Austria bakunjung ka U.S"", ""Dapatlah ikam arti pidatu ujar pajabat yang bakunjung tadi?"", ""Inya maubah puisi Prancis jadi Inggris"", ""Inya manarjamahakan gasan U.N"".",,
107018,,VERB,"connect, link, tie, link up","sambung, tapaut, ikat, manautakan",,"connect, fasten, or put together two or more pieces",mamasang dua banda atau labih supaya tahubung,,"""Can you connect the two loudspeakers?""; ""Tie the ropes together""; ""Link arms""","""Kawalah ikam manyambungakan dua salon tuh?"", ""Maikat talinya baimbai"", ""Bagandingan langan""",,
111116,Perceive_110812 ,VERB,listen,dangari,,hear with intention,mandangarakan bujur-bujur,,"""Listen to the sound of this cello""","""Dangari suara cellonya""",,
111115,Perceive_110812 ,VERB,hear,dangar,,perceive  (sound) via the auditory sense,mamakai indra pandangaran,,,ikam mandangarlah habarnya kamarian?,,
104971,Communicate_103972 ,VERB,"talk, speak","pandir, bapandir",,exchange thoughts; talk with,bapandiran ,,"""We often talk business""; ""Actions talk louder than words""","""Kami rancak mamandirakan bisnis"", ""Tingkah labih bamakna daripada kata-kata""",,
104976,Communicate_103972 ,VERB,"speak, talk","bapandir, pandir",,use language,mamakai bahasa gasan bapandir,,"""the baby talks already""; ""the prisoner won't speak""; ""they speak a strange dialect""","""Anaknya nang halus bisa sudah bapandir"", ""Nang ditangkap kada hakun bapandir"", ""Buhannya nitu pabandir lugatnya pina anih""",,
111130,Sound_111147 ,VERB,"make noise, resound, noise","baabut, maulangi suara, abut",,emit a noise,kada kawa bahinip,,,"jangan abut di parpustakaan!, Suaranya tapantul pas inya banyanyi, baapaan urang abutnya",,
109106,,VERB,"affect, impress, move, strike","pangaruh, katuju (pamulaan tatamu urang), mamindah, manyarang",,have an emotional or cognitive impact upon,pina tapangaruh,,"""This child impressed me as unusually mature""; ""This behavior struck me as odd""","""Kakanak ngini maulah aku marasa diwasa"", ""Kalakuannya pina kada wajar""",,
113205,,VERB,be,jadi/ada,,"have the quality of being; (copula, used with an adjective or a predicate noun)",ada kualitasnya,,"""John is rich""; ""This is not a good answer""","""John tuh urang sugih"", ""Jangan jawaban ini, kada baik""",,
107064,Coat_106526 ,VERB,paint,cat ,,apply paint to; coat with paint,manguas cat,,"""We painted the rooms yellow""","""Kami mancat ruangannya jadi kuning""",,
113216,,VERB,"end, stop, finish, terminate, cease","ujung, diam, tuntung, manuntungakan, maampihi",,"have an end, in a temporal, spatial, or quantitative sense; either spatial or metaphorical","ada ujungnya, ada akhirnya",,"""the bronchioles terminate in a capillary bed""; ""Your rights stop where you infringe upon the rights of other""; ""My property ends by the bushes""; ""The symphony ends in a pianissimo""","""Bronkiolus singgah di jaringan kapilar (bahinak?)"", ""Hak-hak kam runtuh mun ikam malanggar hak orang lain"", ""Barangku ujungnya ta ka padang rumput"", ""Nada pianonya tuntung dah""",,
109119,Affect_109106 ,VERB,"disturb, upset, trouble","taganggu, sarik, bamasalah",,move deeply,masalah emosi,,"""This book upset me""; ""A troubling thought""","""Bukunya mamuyaki"", ""Pikirannya bamasalah""",,
111167,Sound_111147 ,VERB,"ring, peal","bunyi, kumandang ",,sound loudly and sonorously,bunyi nyaring,,"""the bells rang""","""Luncingnya babunyi""",,
111175,Sound_111147 ,VERB,chime,babunyi,,emit a sound,mangaluarakan bunyi,,"""bells and gongs chimed""","""Luncing lawan gong berbunyi (bergema)""",,
111177,Sound_111147 ,VERB,rustle,garisik,,make a dry crackling sound,suara bagarisik,,"""rustling silk""; ""the dry leaves were rustling in the breeze""","""Sutra bagarisik"", ""Dadaunan karing bagarisik ditampuh angin""",,
109140,Love_109139 ,VERB,love,cinta ,,be enamored or in love with,jalinan sabagai kakasih,,"""She loves her husband deeply""","""Inya cinta banar lawan lakinya""",,
113235,,VERB,"be, live","ada, hidup",,"have life, be alive",hidup di dunia,,"""Our great leader is no more""; ""My grandfather lived until the end of war""","""Pamimpin baik kita sudah kadada lagi"", ""Kaiku hidup sampai perang tuntung""",,
109150,,VERB,like,katuju,,find enjoyable or agreeable,katuju atawa manikmati,,"""I like jogging""; ""She likes to read Russian novels""","""Aku katuju bukah saisukan"", ""Inya katuju mambaca novel rusia""",,
111198,Sound_111147 ,VERB,"tinkle, tink, clink, chink","babunyi ""ting/kling""",,make or emit a high sound,maulah bunyi yang tinggi,,"""tinkling bells""","""Luncing babunyi""",,
107112,Hit_107274 ,VERB,kick,sipak,,strike with the foot,manyipak pakai batis,,"""The boy kicked the dog""; ""Kick the door down""","""Kakanakan nituh manyipak anjing"", ""Sipak lawangnya""",,
109163,,VERB,"fear, dread","takutan, gair",,be afraid or scared of; be frightened of,takutan lawan (urang/banda),,"""I fear the winters in Moscow""; ""We should not fear the Communists!""","""Aku takutan lawan musim dingin di Moscow"", ""Kita kada saharusnya takutan lawan komunis!""",,
109166,Worry_109102 ,VERB,fear,takutan,,be afraid or feel anxious or apprehensive about a possible or probable situation or event,takutan atawa gair lawan kajadian,,"""I fear she might get aggressive""","""Aku takutannya kalu pina inya mangaras""",,
100975,,VERB,"change, alter, vary","baubah, baganti, babida",,"make or become different in some particular way, without permanently losing one's or its former characteristics or essence",ada parbidaan,,"""her mood changes in accordance with the weather""; ""The supermarket's selection of vegetables varies according to the season""","""Tingkahnya baubah sasuai ari"", ""Tukunya mamilih-milih sayur manyasuaiakan musim""",,
100988,,VERB,"change, alter, modify","baubah, baganti, bamudip",,cause to change; make different; cause a transformation,maubah bantuk,,"""The advent of the automobile may have altered the growth pattern of the city""; ""The discussion has changed my thinking about the issue""","""Kuta wahini baubah imbah mutur diciptaakan"", ""Diskusi ngini maubah pamikiranku tantang habar ngitu""",,
111231,,VERB,"recognize, recognise, distinguish, discern, pick out, make out, tell apart","maminandui, mambidaakan, mamilih, maulah, mamisahakan",,detect with the senses,marasa-rasaakan,,"""The fleeing convicts were picked out of the darkness by the watchful prison guards""; ""I can't make out the faces in this photograph""","""Bubuhan napi ngitu kawa ditangkap pulang ulih panjaga imbah kabur malam-malam"", ""Aku kada kawa maminandui muha-muha di gambar ngini""",,
111236,,VERB,"taste, savor, savour","marasai, rasa, manikmati",,have flavor; taste of something,marasai supaya tahu rasanya,,,"rasa kupinya mantap banar!, manikmati mumen ini gasan kanang-kanangan",,
109202,Displease_109337 ,VERB,"annoy, rag, get to, bother, get at, irritate, rile, nark, nettle, gravel, vex, chafe, devil","muyak, marigati, mahaur, mamauki, mamuyaki, mangganggu",,"cause annoyance in; disturb, especially by minor irritations",diganggu,,"""Mosquitoes buzzing in my ear really bothers me""; ""It irritates me that she never closes the door after she leaves""","""Suara nyamuk ni mangganggu talinga ja"", ""Kada kawa kalu inya tuh manutup lawang imbah kaluar, mauk banar""",,
105111,Communicate_103972 ,VERB,write,manulis,,communicate or express by writing,maungkap akan lewat tulisan ,,"""Please write to me every week""",tolong pang tulis surat gasan aku saban minggu,,
107163,,VERB,"gather, garner, collect, pull together",kumpulakanu,,assemble or get together,bakumpulan ,,"""gather some stones""; ""pull your thoughts together""","kumpulakan supalih batu, gabungakan pikiran ikam",,
111263,Transfer_111354 ,VERB,give,mambari,,transfer possession of something concrete or abstract to somebody,memamindahakan kepemilikan nang abstra ke orang,,"""I gave her my money""; ""can you give me lessons?""; ""She gave the children lots of love and tender loving care""","ulun mambari inya duit ulun, kawalah ikam mambari aku palajaran?, inya mambari kakanakan  banyak kasih sayang lawan parhatian ",,
111274,Have_111278 ,VERB,"keep, hold on",kumpulakan,,retain possession of,menahan posisinya,,"""Can I keep my old stuffed animals?""; ""She kept her maiden name after she married""","kawalah aku manyimpani boneka binatang lawasku?, inya tatap ae mamakai ngaran bujangnya pas imbah kawin",,
111283,,VERB,"own, have, possess",ampun,,have ownership or possession of,ampunya,,"""He owns three houses in Florida""; ""How many cars does she have?""","inya baisi rumah tiga buah di Florida, Seapa banyak motor yang inya baisi?",,
113333,Happen_102027 ,VERB,turn out,sekalinya,,prove to be in the result or end,hasilnya di akhir,,"""It turns out that he was right""",sakalinya inya bujur,,
111296,Get_111310 ,VERB,"buy, purchase",tukar,,obtain by purchase; acquire by means of a financial transaction,mandapat hasil,,"""The family purchased a new car""; ""The conglomerate acquired a new company""; ""She buys for the big department store""",kaluarganya manukar motor hanyar,,
101058,Change state_101049 ,VERB,"become, go, get",datang,,enter or assume a certain state or condition,me asumsikan keadaan ,,"""He became annoyed when he heard the bad news""; ""It must be getting more serious""; ""her face went red with anger""; ""She went into ecstasy""; ""Get going!""","inya jadi muar imbah mandangar habar kada baik ngintu, pasti jadi batambah sarius, muhanya bahabang imbah gegara sangit, inya jadi himung banar, tulak dah!",,
113352,,VERB,wait,hadang,,stay in one place and anticipate or expect something,bagana di satu tempat,,"""I had to wait on line for an hour to get the tickets""",ulun harus maantri sejam gasan mandapatakan tiket,,
109255,Disappoint_109254 ,VERB,"fail, betray",bahianat,,"disappoint, prove undependable to; abandon, forsake",kd kawa diharap,,"""His sense of smell failed him this time""; ""His strength finally failed him""; ""His children failed him in the crisis""","panciumannya hari ini kada berhasil inya kecewa, kakuatannya mangacewakan inya, kakanakan mangacewakan kacamuhan",,
101067,Change magnitude_101155 ,VERB,"decrease, diminish, lessen, fall",tuntung,,"decrease in size, extent, or range",bahalus,,"""The amount of homework decreased towards the end of the semester""; ""The cabin pressure fell dramatically""; ""her weight fall to under a hundred pounds""; ""his voice fell to a whisper""","tugas rumah parak tuntung gawi parak akhir semester, takanan kabinya bakurang, barat awaknya baturun seratus pon",,
111307,Get_111310 ,VERB,"receive, have",dapat,,get something; come into possession of,dapat sesuatu,,"""receive payment""; ""receive a gift""; ""receive letters from the front""","mendapat bayaran, mendapat hadiah, mendapat surat dari muka",,
111310,,VERB,"get, acquire",dapat,,come into the possession of something concrete or abstract,dapat sesuatu,,"""She got a lot of paintings from her uncle""; ""They acquired a new pet""; ""Get your results the next day""; ""Get permission to take a few days off from work""","inya dapat banyak lukisan dari pamanya, inya dapat peliharaan hanyar, dapat kan hasil ikam esok, dapat izin gasar beberapa hari",,
103127,Change_100988 ,VERB,shake,guncang,,bring to a specified condition by or as if by shaking,kondisi tertentu,,"""He was shaken from his dreams""; ""shake the salt out of the salt shaker""","inya tebangun dari mimpinya, keluar akan garam dari wadahnya",,
107230,Rub_106441 ,VERB,"wipe, pass over",bersih akan ,,rub with a circular motion,barasih akan ,,"""wipe the blackboard""; ""He passed his hands over the soft cloth""","bersih akan papan tulisnya, inya mambarsihkan tangan nyd di kain lembut",,
101088,Change magnitude_101155 ,VERB,increase,maningkat,,become bigger or greater in amount,jadi lebih ganal,,"""The amount of work increased""",gawianya meningkat,,
107238,Clean_107944 ,VERB,sweep,barasihakan,,clean by sweeping,mambarsihkan dengan sapu,,"""Please sweep the floor""",sapu akan lantainya,,
107237,Wipe_107230 ,VERB,"sweep, broom",sapu,,sweep with a broom or as if with a broom,manyapu denga sapu,,"""Sweep the crumbs off the table""; ""Sweep under the bed""",sapu kebawah kasur,,
107268,Strike_107329 ,VERB,beat,pukul,,hit repeatedly,rancak mamukul,,"""beat on the door""; ""beat the table with his shoe""","pukul pintunya, Hantakan meja dengan sepatu",,
105220,Assert_105223 ,VERB,"allege, aver, say",padah,,report or maintain,mamadahakan,,"""He alleged that he was the victim of a crime""; ""He said it was too late to intervene in the war""; ""The registrar says that I owe the school money""",,,
113411,Be_113435 ,VERB,"dwell, live, inhabit",tinggal,,inhabit or live in,tinggal,,"""People lived in Africa millions of years ago""; ""The people inhabited the islands that are now deserted""; ""this kind of fish dwells near the bottom of the ocean""",orang tinggal di Afrika 1juta tahun nang lalu,,
113420,Keep_113419 ,VERB,herd,mengambala,,"keep, move, or drive animals",mengembala,,"""Who will be herding the cattle when the cowboy dies?""",siapa nang mengembala ternaknya mun koboy mati,,
111404,Transfer_111354 ,VERB,"pass, hand, reach, pass on, turn over, give",unjuk,,place into the hands or custody of,unjuk ke orang,,"""hand me the spoon, please""; ""Turn the files over to me, please""; ""He turned over the prisoner to his lawyers""","tolong unjuk ke aku sendoknya, bari ke aku berkasnya, tahanan itu di julung ke pengacaranya",,
109375,Desire_109379 ,VERB,"wish, wish well",baharap,,feel or express a desire or hope concerning the future or fortune of,marasa,,,,,
105279,Label_105285 ,VERB,"name, call",ngaran,,assign a specified (usually proper) proper name to,manatapakan nama,,"""They named their son David""; ""The new school was named after the famous Civil Rights leader""","buhannya mengarani anak lainnya David, sekolah hanyar itu dingarani orang terkenal",,
109379,,VERB,"desire, want",handak,,feel or have a desire for; want strongly,baharap kuat,,"""I want to go home now""; ""I want my own room""","aku handak Bulik Wah ini, aku handak kamar sorangan",,
105291,Transfer_111410 ,VERB,"mail, post, send",kirim,,cause to be directed or transmitted to another place,andak kalain,,"""send me your latest results""; ""I'll mail you the paper when it's written""","kirimkan hasil nang hanyar ke aku, aku kirim kertasnya tuntung ku tulis",,
107350,Rap_107349 ,VERB,knock,katuk,,rap with the knuckles,mangatuk,,"""knock on the door""",katuk pintunya,,
