"tie down, tie up, bind, truss",secure with or as if with ropes,"bağlamak, dizginlemek, hapsetmek, rehin almak, gözaltına almak","Birinin, bir şeyin davranışlarını önlemek."
bear,massive plantigrade carnivorous or omnivorous mammals with long shaggy coats and strong claws,ayı,"Memelilerin etobur takımından, beş parmaklı, tabanlarına basarak yürüyen, yurdumuzda boz türü bulunan, iri gövdeli hayvan; kocaoğlan (Ursus arctos)."
"luminosity, brightness, brightness level, luminance, luminousness, light",the quality of being luminous; emitting or reflecting light,"parlaklık, parlaklık seviyesi, ışık, ışık şiddeti","Cisimleri görmeyi, renkleri ayırt etmeyi sağlayan fiziksel enerji."
spider,predatory arachnid that usually has silk-spinning organs at the back end of the body; they spin silk to make cocoons for eggs or traps for prey,örümcek,"Örümcekler takımından, ince bir ağ örerek küçük böcekleri avlayan eklemli bir hayvan; örümce (Araneae)."
"fill, fill up, make full","make full, also in a metaphorical sense",doldurmak,"Dolmasını sağlamak, dolu duruma getirmek. "
"grief, sorrow",something that causes great unhappiness,"keder, üzüntü, ıstırap",Maddi ve manevi olarak duyulan aşırı üzüntü.
"idea, thought",the content of cognition; the main thing you are thinking about,"fikir, düşünce","Uzay ve zamanın ötesinde, öznenin dışında, kendiliğinden var olan, duyularla değil, yalnızca ruhen algılanabilen asıl gerçeklik."
"state, province",the territory occupied by one of the constituent administrative districts of a nation,"il, vilayet, eyalet",Çoğunlukla valilerce yönetilen ve yönetim bakımından bir tür bağımsızlığı olan yönetim bölgesi.
"blanket, cover",bedding that keeps a person warm in bed,"battaniye, örtü","Yorgan yerine veya yorgan üstünde kullanılan, çoğu yünden dokunmuş kalınca örtü."
"laugh, express joy, express mirth",produce laughter,gülmek,"İnsan, hoşuna veya tuhafına giden olaylar, durumlar karşısında, genellikle sesli bir biçimde duygusunu açığa vurmak."
"willow, willow tree",any of numerous deciduous trees and shrubs of the genus Salix,"söğüt, söğüt ağacı","Söğütgillerden, sulak yerlerde yetişen, yaprakları almaşık ve alt yüzleri havla örtülü büyük bir ağaç (Salix)."
"succeed, win, come through, bring home the bacon, deliver the goods",attain success or reach a desired goal,"başarmak, kazanmak, üstesinden gelmek, elde etmek, üzerine düşeni yapmak",Bir işi istenilen bir biçimde bitirmek.
"adept, expert, good, practiced, proficient, skillful, skilful",having or showing knowledge and skill and aptitude,"usta, uzman, iyi, deneyimli, yetenekli, becerikli","Belli bir işte, belli bir konuda bilgi, görüş ve becerisi çok olan (kimse)."
corner,the point where three areas or surfaces meet or intersect,köşe,"Birbirini kesen iki çizginin, iki düzlemin oluşturduğu açı."
blunt,used of a knife or other blade; not sharp,"kör, körelmiş",Keskinliği yeterli olmayan.
"kind, sort, form, variety",a category of things distinguished by some common characteristic or quality,"tür, cins, çeşit, çeşitlilik",Aynı çeşit varlıklar veya nesneler içinde ortak özellikleri bulunanların her biri.
sharp,having or made by a thin edge or sharp point; suitable for cutting or piercing,keskin,"Çok kesici, iyi kesen."
"botch, bodge, bumble, fumble, botch up, muff, blow, flub, screw up, ball up, spoil, muck up, bungle, fluff, bollix, bollix up, bollocks, bollocks up, bobble, mishandle, louse up, foul up, mess up, fuck up","make a mess of, destroy or ruin","berbat etmek, içine etmek, batırmak, baştan savma yapmak, rezil etmek, eline yüzüne bulaştırmak, gelişigüzel yapmak, becerememek, yüzüne gözüne bulaştırmak, mahvetmek, çuvallamak, sıçıp batırmak, berbat etmek, bok etmek, çorba etmek, bozmak, kötü yönetmek, acemice davranmak, allak bullak etmek, karıştırmak, ırgat pazarına döndürmek, talan etmek, altüst etmek, ahıra çevirmek, darmadağın etmek, işleri Arap saçına çevirmek, boka sarmak, içine sıçmak","bozup berbat etmek, başaramamak"
bathe,cleanse the entire body,"banyo yapmak, çimmek, yıkanmak",Kendi vücudunu yıkamak
"wash, lave",cleanse (one's body) with soap and water,yıkamak,Su veya başka bir sıvı kullanarak bir şeyi temizlemek.
friend,a person you know well and regard with affection and trust,"arkadaş, yoldaş",Birbirlerine karşı sevgi ve anlayış gösteren kimselerden her biri.
"rush, hasten, hurry, look sharp, festinate",act or move at high speed,"acele etmek, acele ettirmek, hızlandırmak, eli çabuk tutmak, eli çabuk olmak",çabuk davranmak
"idol, graven image, god",a material effigy that is worshipped,"put, tanrı",Bazı ilkel toplumlarda doğaüstü güç ve etkisi olduğuna inanılan canlı veya cansız nesne; tapıncak.
tip,the extreme end of something; especially something pointed,uç,Bir uzaklığın son noktası
weight,the vertical force exerted by a mass as a result of gravity,ağırlık,"Yer çekiminin, bir cismin molekülleri üzerindeki etkisinin oluşturduğu bileşke; gravite."
hay,grass mowed and cured for use as fodder,saman,"Ekinlerin harmanda dövülüp taneleri ayrıldıktan sonra kalan, hayvanlara yedirilen ufalanmış sapları."
"join, bring together",cause to become joined or linked,"birleştirmek, bir araya getirmek, bağlamak",toplamak
"try, seek, attempt, essay, assay",make an effort or attempt,"denemek, teşebbüs etmek, çabalamak, peşinde koşmak, gayret etmek, uğraşmak, girişimde bulunmak, kalkışmak, test etmek, sınamak","Bir işe, başarmak amacıyla başlamak, girişimde bulunmak; teşebbüs etmek."
town,an urban area with a fixed boundary that is smaller than a city,"kasaba, belde","İlçeden küçük, köyden büyük, nüfusu iki bin ile yirmi bin arasında olan, belediye ile yönetilen, henüz kırsal özelliklerini yitirmemiş yerleşim merkezi."
"comb, comb out, disentangle",smoothen and neaten with or as with a comb,"taraklamak, taramak, açmak",Bir şeyin tellerini birbirinden ayırıp karışıklığını gidermek.
spade,a sturdy hand shovel that can be pushed into the earth with the foot,kürek,"Toprak, kömür vb.ni bir yerden bir yere alıp atmaya, taşımaya yarayan ve yayvan bir bölümü, buna bağlı uzun bir sapı bulunan araç"
ask,address a question to and expect an answer from,sormak,Birine soru yönelterek herhangi bir konuda bilgi istemek.
"feel, sense","perceive by a physical sensation, e.g., coming from the skin or muscles","hissetmek, algılamak",Bir olayı veya bir nesnenin varlığını duyu organlarıyla kavramak.
strength,the property of being physically or mentally strong,güç,"Fizik, düşünce ve ahlak yönünden bir etki yapabilme veya bir etkiye direnebilme yeteneği."
"village, hamlet",a settlement smaller than a town,"köy,mezra","Belediye teşkilatına sahip olmayan, ortak veya özel malları bulunan, nüfusu iki binden aşağı olan, genellikle tarımsal alanda çalışılan, konutları ve öteki yapıları bu hayata uygun yerleşim birimi; köylük yer, köy yeri, karye."
hear,receive a communication from someone,"duymak, işitmek","İşitmek, ses almak."
stupid,lacking or marked by lack of intellectual acuity,aptal,Zekâsının azlığından dolayı yeterince düşünemeyip akıllıca hareket edemeyen (kimse).
boat,a small vessel for travel on water,"tekne, bot",Bir tür küçük deniz taşıtı.
"cut off, chop off, lop off",remove by or as if by cutting,"kesmek, budamak, kesip atmak, koparmak","Son vermek, gidermek; bir şeyden yoksun bırakmak, vermemek."
far,at a great distance in time or space or degree,"uzak, ırak","Gidilmesi çok süren, çok ötelerde bulunan"
"pipe, tube",a hollow cylindrical shape,boru,"Bir yerden başka bir yere sıvı, gaz vb. aktarmaya yarayan, içi boş, uçları açık, uzun ve dar silindir:"
"longing, yearning, hungriness",prolonged unfulfilled desire or need,"özlem, hasret, açlık","Bir kimseyi veya bir şeyi görme, kavuşma isteği; aşırı istek içinde bulunma."
smooth,having a surface free from roughness or bumps or ridges or irregularities,pürüzsüz,Yüzeyinde girinti çıkıntı olmayan.
bark,tough protective covering of the woody stems and roots of trees and other woody plants,"kabuk, ağaç kabuğu","Bir şeyin üstünü kaplayan ve onu dış etkilere karşı koruyan, kendiliğinden oluşmuş sertçe bölüm."
"near, close, nigh",not far distant in time or space or degree or circumstances,"yakın, yakında, dip","Az bir ara ile ayrılmış olan (zaman veya yer), uzak karşıtı."
branch,"a division of a stem, or secondary stem arising from the main stem of a plant",dal,Ağacın gövdesinden ayrılan kollardan her biri.
"rear, raise, bring up, nurture, parent",bring up,"büyütmek, yetiştirmek","Gelişip büyümesini sağlamak, büyümesine özen göstermek."
"periphery, fringe, outer boundary",the outside boundary or surface of something,"çevre, saçak, dış sınır", Düzlem üzerindeki bir şekli sınırlayan çizgi.
"branchlet, twig, sprig",a small branch or division of a branch (especially a terminal division); usually applied to branches of the current or preceding year,"dalcık, ince dal, filiz","Ana dalın kollarından her biri, küçük dal."
"voice, vocalization, vocalisation, vocalism, phonation, vox",the sound made by the vibration of vocal folds modified by the resonance of the vocal tract,"ses, seslenme, ünleme, seslendirme",Akciğerlerden gelen havanın gırtlakta oluşturduğu titreşim.
"dress, clothe, enclothe, garb, raiment, tog, garment, habilitate, fit out, apparel",provide with clothes or put clothes on,"giyinmek, kuşanmak, giydirmek, kuşatmak, donatmak, örtmek, örtünmek, sarmak",Örtünüp korunmak için bir şeyi vücuduna geçirmek.
"charcoal, wood coal",a carbonaceous material obtained by heating wood or other organic matter in the absence of air,"kömür, kara elmas, odun kömürü, mangal kömürü.","Karbonlu maddelerin kapalı ve havasız yerlerde için için yanmasından veya çok uzun süre derin toprak katmanları altında kalıp birtakım kimyasal değişmelere uğramasından oluşan, siyah renkli, bitkisel kaynaklı, içinde yüksek oranda karbon bulunan katı yakıt.; Odunun kömürleştirilmesiyle elde edilen, kalori değeri düşük kömür"
"chicken, gallus gallus",a domestic fowl bred for flesh or eggs; believed to have been developed from the red jungle fowl,tavuk,"Sülüngillerden, eti ve yumurtası için üretilen kümes hayvanı (Gallus)."
"notice, mark, note",notice or perceive,"farkına varmak, fark etmek, dikkat etmek, dikkate almak, dikkat çekmek","duygularla düşünceyi bir şey üzerinde toplamak, uyanık davranmak."
"trunk, tree trunk, bole",the main stem of a tree; usually covered with bark; the bole is usually the part that is commercially useful for lumber,"gövde, ağaç gövdesi",Ağaç ve bitkilerin dallarının dışında kalan ana bölümü.
"cock, rooster",adult male chicken,horoz,"Tavukgillerden, tavuğun erkeği olan kümes hayvanı."
"salt, table salt, common salt",white crystalline form of especially sodium chloride used to season and preserve food,"tuz, sofra tuzu, yemek tuzu, mutfak tuzu","İyot bakımından zenginleştirilmiş, ince toz hâline getirilmiş tuz."
"wear, put on, get into, don, assume",put clothing on one's body,"giydirmek, örtmek",Giyme işini yaptırmak
"doll, dolly",a small replica of a person; used as a toy,"bebek, oyuncak bebek","Plastik, tahta, bez vb.nden yapılan insan biçiminde oyuncak."
take off,remove clothes,"çıkarmak, soyunmak",Üstündeki giysilerin bir bölümünü veya tümünü çıkarmak.
"murmur, mutter, grumble, croak, gnarl",make complaining remarks or noises under one's breath,"mırıldanmak, homurdanmak, söylenmek",Alçak sesle kendi kendine bir şeyler söylemek.
wing,a movable organ for flying (one of a pair),kanat,Kuşlarda ve böceklerde uçmayı sağlayan organ.
"bite, sting, burn",cause a sharp or stinging pain or discomfort,"batmak, sızlamak, yakmak, ısırmak","Sinir uçlarının şiddetli biçimde uyarılmasıyla ortaya çıkan, vücudun herhangi bir yerinde oluşan rahatsızlık hissi."
"scrape, grate",scratch repeatedly,"kazımak, aşındırmak, tırmalamak",Sürekli hareketlerle bir bölgenin yüzeyine zarar vermek.
"dance, trip the light fantastic, trip the light fantastic toe",move in a pattern; usually to musical accompaniment; do or perform a dance,"dans etmek, oynamak",müzik temposuna uyarak estetik değer taşıyan vücut hareketleri yapmak.
"dig, delve, cut into, turn over","turn up, loosen, or remove earth","kazmak, bellemek, çukur açmak, çukur kazmak, ","toprağı açmak, oymak"
"ache, smart, hurt",be the source of pain,"acımak, sızlamak, ağrımak ",Vücudun bir yeri ağrılı durumda olmak.
heavy,of comparatively great physical weight or density,ağır,"Tartıda çok çeken; kilolu, sakil, hafif karşıtı."
space,an empty area (usually bounded in some way between things),"boşluk, açıklık, aralık","Oyuk, çukur, kapanmamış yer."
"exclaim, cry, cry out, outcry, call out, shout","utter aloud; often with surprise, horror, or joy","haykırmak, ağlamak, hıçkırmak, bağırmak, feryat etmek","İnsan yüksek ve gür ses çıkarmak; bağırmak, feryat etmek"
"battle, conflict, fight, engagement",a hostile meeting of opposing military forces in the course of a war,"savaş, çatışma, kavga, muharebe, harp",Devletlerin diplomatik ilişkilerini keserek giriştikleri silahlı mücadele.
"picture, image, icon, ikon",a visual representation (of an object or scene or person or abstraction) produced on a surface,"resim, simge, şekil, görsel","Görünen şey, görüntü."
"smoke, smoking",a hot vapor containing fine particles of carbon being produced by combustion,duman,Bir maddenin yanması ile çıkan ve içinde katı zerrelerle buğu bulunan değişik renklerde gaz.
smell,inhale the odor of; perceive by the olfactory sense,koklamak,Kokusunu duymak için bir şeyi burnuna yaklaştırmak veya bir yerin havasını içine çekmek.
"rescue, deliver",free from harm or evil,kurtarmak,"Bir canlıyı bir felaketten, tehlikeden veya zor durumdan uzaklaştırmak; bir şeye zarar gelmesini önlemek."
claw,sharp curved horny process on the toe of a bird or some mammals or reptiles,pençe,Yırtıcı hayvanların ön ayaklarının parmaklarıyla tırnakları.
boot,footwear that covers the whole foot and lower leg,"bot, çizme","Uzun konçlu, kapalı ayakkabı."
fish,any of various mostly cold-blooded aquatic vertebrates usually having scales and breathing through gills,balık,"Omurgalılardan, suda yaşayan, solungaçla nefes alan ve yumurtadan üreyen hayvanların genel adı."
tail,the posterior part of the body of a vertebrate especially when elongated and extending beyond the trunk or main part of the body,kuyruk,"Hayvanların çoğunda, gövdenin sonunda bulunan, omurganın uzantısı olan uzun ve esnek organ."
"complete, finish",come or bring to a finish or an end,"tamamlamak, bitirmek",Tam ve eksiksiz duruma getirmek.
so,"in such a condition or manner, especially as expressed or implied","bu durumda, o şekilde, öyle, böyle",Bir şeyin içinde bulunduğu koşulların şu anki hali.
"search, seek, look for","try to locate or discover, or try to establish the existence of","aramak, araştırmak, bakmak",Birini veya bir şeyi bulmaya çalışmak.
"lie, prevarication",a statement that deviates from or perverts the truth,yalan,"Doğru olmayan, gerçeğe uymayan söz."
see,perceive by sight or have the power to perceive by sight,görmek,"Gözle algılamak, seçmek."
spoon,a piece of cutlery with a shallow bowl-shaped container and a handle; used to stir or serve or take up food,kaşık,Sulu veya bazı ufak taneli yiyecekleri ağza götürmeye yarayan saplı sofra aracı.
"bare, au naturel, naked, nude",completely unclothed,"çıplak, açık, nü, üryan, cıbıldak, yalıncak, cıbıl","Üstünde bulunması gereken giysi, örtü vb. bulunmayan."
look,perceive with attention; direct one's gaze towards,bakmak,Bakışı bir şey üzerine çevirmek.
"obstruct, blockade, block, hinder, stymie, stymy, embarrass",hinder or prevent the progress or accomplishment of,"engellemek, abluka altına almak, kuşatmak, bloke etmek, tıkamak, köstek olmak, aksatmak, ket vurmak, bozmak, mani olmak",Bir şeyin gerçekleşmesini veya yapılmasını önlemek.
"violence, force",an act of aggression (as one against a person who resists),"şiddet, güç",Duygu veya davranışta aşırılık.
"reason, ground",a rational motive for a belief or action,"neden, sebep, niçin, gerekçe",Bir şeyin olmasına veya belli bir hâlde bulunmasına yol açan şey
"freeze, frost",weather cold enough to cause freezing,"don, buz",Hava sıcaklığının sıfırdan aşağı düşmesiyle suların buz tutması.
pillow,a cushion to support the head of a sleeping person,yastık,"Başın altına koymak veya sırtı dayamak için kullanılan, içi yün, pamuk, kuş tüyü, ot vb. malzemeyle doldurulmuş küçük minder."
"look, appear, seem",give a certain impression or have a certain outward aspect,"görünmek, gözükmek",İzlenim uyandırmak
sound,give off a certain sound or sounds,ses,Kulağın duyabildiği titreşim.
"indicate, point, show","indicate a place, direction, person, or thing; either spatially or figuratively","işaret etmek, göstermek,göstermek","Bir şeyi, bir durumu el, yüz hareketleriyle anlatmak"
bow,curved piece of resilient wood with taut cord to propel arrows,yay,"Ok atmaya yarayan, iki ucu arasına kiriş gerilmiş, eğri ağaç veya metal çubuk."
"cry, weep","shed tears because of sadness, rage, or pain","ağlamak, zırlamak","Üzüntü, acı, sevinç, pişmanlık vb.nin etkisiyle gözyaşı dökmek"
"war, warfare",the waging of armed conflict against an enemy,"savaş, harp",mücadele
"at a time, at once, at one time",simultaneously,"bir sefer, tek sefer, aynı anda, birden", Aynı zamanda oluşan.
kill,"cause the death of, without intention",öldürmek,Bir canlının hayatına son vermek.
"convey, impart","make known; pass on, of information","iletmek, aktarmak","Bir konu, haber vb.ni iletmek, bildirmek"
"show, show up",be or become visible or noticeable,"ortaya çıkmak, çıkagelmek, belli olmak","yokken var olmak, meydana çıkmak; kendini göstermek"
box,a (usually rectangular) container; may have a lid,kutu,"İnce tahta, mukavva, teneke, plastik vb.nden yapılmış, genellikle kapaklı kap."
sing,produce tones with the voice,şarkı söylemek,belirli bir besteye göre güfteyi uyumlu olarak okumak.
work,activity directed toward making or doing something,çalışma,"Bir sonuç elde etmek, herhangi bir şey ortaya koymak için güç harcayarak yapılan etkinlik."
"sew, run up, sew together, stitch",fasten by sewing; do needlework,"dikmek, dikivermek, birlikte dikmek, dikiş dikmek, dikiş yapmak","Biçilmiş veya yırtılmış kumaş, deri, yara vb.ni iğneye geçirilmiş iplikle tutturmak."
"company, companionship, fellowship, society",the state of being with someone,"eşlik, arkadaşlık, dostluk, yoldaş, yoldaşlık","Birlikte, beraber olma durumu."
conversation,the use of speech for informal exchange of views or ideas or information etc.,"konuşma, görüşme","Bir iş, bir konu üzerinde karşılıklı görüş ileri sürmek; müzakere etmek."
"grandfather, gramps, granddad, grandad, granddaddy, grandpa",the father of your father or mother,"dede, büyükbaba, büyükpeder",Torunu olan erkek.
"grandma, grandmother, granny, grannie, gran",the mother of your father or mother,"anneanne, babaanne, büyükanne",Annenin annesi; babanın annesi.
"hide, conceal",prevent from being seen or discovered,"saklanmak, gizlemek, gizlenmek",Kendini veya bir şeyi saklamak.
staff,a strong rod or stick with a specialized utilitarian purpose,sopa,Kalın değnek.
"tire, wear upon, tire out, wear, weary, jade, wear out, outwear, wear down, fag out, fag, fatigue",exhaust or get tired through overuse or great strain or stress,"yorulmak, yıpranmak, pestilini çıkarmak, bitkin düşümek, sucuğunu çıkarmak, bezmek, usanmak, tükenmek, cıcığını çıkarmak, haşat olmak, canı çıkmak","Güçsüzleşmek, bitkinleşmek, yılgınlaşmak."
"glue, paste",join or attach with or as if with glue,"yapıştırmak, zamklamak",Yapışkan bir maddeye bulanmış olan bir şeyi ayrılmayacak bir biçimde bir yere tutunup kalması.
"alone, solo, unaccompanied",without anybody else,"yalnız, tek başına, refakatsiz",Yanında başkaları bulunmayan.
cover,provide with a covering or cause to be covered,"kaplamak, örtmek","Her yanını örtmek, çepeçevre sarmak."
"deceive, lead on, delude, cozen",be false to; be dishonest with,"aldatmak, kandırmak, dolandırmak",Beklenmedik bir davranışla yanıltmak.
ail,"be unwell, ill, or ill disposed",hastalanmak,"Sağlığı bozulmak, esenliği yerinde olmamak."
"bay, embayment",an indentation of a shoreline larger than a cove but smaller than a gulf,koy,"Denizin, gölün küçük girintiler biçiminde karaya doğru sokulmuş bölümü"
watch,look attentively,"izlemek, seyretmek",bakmak
fog,droplets of water vapor suspended in the air near the ground,sis,Atmosferdeki su buharının yeryüzüne yakın yerlerde yoğuşmasıyla oluşan alçak bulut tabakası.
all,quantifier; used with either mass or count nouns to indicate the whole number or amount of or every one of a class,"tüm, bütün",eksiksiz
"guest, invitee",a visitor to whom hospitality is extended,"konuk, misafir, davetli",Bir yere veya birinin evine kısa bir süre kalmak için gelen kimse.
"brain, encephalon",that part of the central nervous system that includes all the higher nervous centers; enclosed within the skull; continuous with the spinal cord,beyin,"afatasının içinde beyin zarları ile örtülü, iki yarım küre biçiminde sinir kütlesinden oluşan, duyum ve bilinç merkezlerinin bulunduğu organ."
"puzzle, puzzler, mystifier, teaser",a particularly baffling problem that is said to have a correct solution,"bulmaca, bilmece, zeka oyunu","Oyuncuların zeka, mantık, dikkat ve hafıza gibi zihinsel yeteneklerini kullanarak çözdükleri; yazılı, sözlü veya mekanik formatlardaki problemlerden oluşan genellikle tek kişilik oyun. "
"count, number, enumerate, numerate",determine the number or amount of,"saymak, numaralandırmak"," Bir şeyin kaç tane olduğunu anlamak için bunları birer birer elden veya gözden geçirmek, sayısını bulmak."
fault,responsibility for a bad situation or event,hata,İstemeyerek ve bilmeyerek yapılan yanlış.
"sicken, come down",get sick,"rahatsızlanmak, yatağa düşmek","Sağlığı bozulmak, hastalanmak, rahatsız olmak."
long,for an extended time or at a distant time,uzun,"Başlangıcı ile bitimi arasında fazla zaman aralığı olan, çok süren"
"egg, eggs",oval reproductive body of a fowl (especially a hen) used as food,"yumurta, yumurtalar",Kanatlı hayvanların çoğalmasını sağlayan kabuklu bir besin maddesi.
count,the total number counted,"sayı, sayım, adet","Sayma, ölçme, tartma vb. işlerin sonucunda ortaya çıkan birimlerin kaç olduğunu bildiren sözlerden her biri."
"bridge, span",a structure that allows people or vehicles to cross an obstacle such as a river or canal or railway etc.,köprü,"Herhangi bir engelle ayrılmış iki yakayı birbirine bağlayan veya trafik akımının, başka bir trafik akımını kesmeden üstten geçmesini sağlayan ahşap, kâgir, beton veya demir yapı."
"flash, blink, wink, twinkle, winkle",gleam or glow intermittently,"parlamak, yanıp sönmek, parıldamak, ışıldamak, ışılamak","Titrek, parlak bir ışık saçmak veya güçlü bir ışık çıkarmak, ışık saçmak."
cuckoo,any of numerous European and North American birds having pointed wings and a long tail,guguk kuşu,"Gugukgillerden, genellikle Avrupa'da yaşayan, dişileri başka kuşların yuvasına yumurtlayarak yavrularının bakım işini onlara gördüren, sırtı gri, karnı kahverengi beyaz çizgili, 35 santimetre boyunda, böcekçil bir kuş. (Cuculus canorus)"
"bird louse, biting louse, louse",wingless insect with mouth parts adapted for biting; mostly parasitic on birds,"bit, kuş biti, ısırıcı bit","Yarım kanatlılar alt takımına giren, insan ve memeli hayvanların vücudunda asalak olarak yaşayan böcek."
"govern, rule",exercise authority over; as of nations,"yönetmek, hükmetmek",Egemenliği altında bulundurmak.
"brook, creek",a natural stream of water smaller than a river (and often a tributary of a river),dere,"Çaydan küçük, yazın kuruyan veya suyu azalan küçük akarsu."
"joy, joyousness, joyfulness",the emotion of great happiness,"sevinç, neşe",Mutlu olmaktan doğan ve dışa vurulan coşku.
"close, shut",move so that an opening or passage is obstructed; make shut,"kapatmak, kapamak",Kapama işini yapmak.
"vainly, in vain",to no avail,"boş yere, kuru kuruya, nedensiz yere, yararsız yere, faydasız yere, sebepsiz yere, gereksiz, boşu boşuna, beyhude, beyhude yere, nafile.","Bir kazanç elde edemeden, yararsız bir biçimde."
"open, open up",cause to open or to become open,"açmak, açılmak",Bir şeyi kapalı durumdan açık duruma getirmek.
"tell, narrate, recount, recite",narrate or give a detailed account of,"anlatmak, söylemek, demek, aktarmak,","Bilgi vermek, nakletmek, bir konu üzerinde açıklama yapmak, açıklamada bulunmak."
milk,a white nutritious liquid secreted by mammals and used as food by human beings,süt,"Kadınların ve memeli dişi hayvanların yavrularını besledikleri, memelerinden gelen, besin değeri yüksek beyaz sıvı."
