27200,Property_27164 ,NOUN,age,"usia, zaman",,how long something has existed,"lama wayah hidup, jangka wayah nang menandai sesuatu",,"""it was replaced because of its age""","Usia tuha, zaman wahini ",,
53621,Medical practitioner_55338 ,NOUN,"doctor, doc, physician, md, dr., medico","dokter, tabib,",,a licensed medical practitioner,"urang nang ahli dalam hal garing wan pangobatan, urang nang maubati ",,"""I felt so bad I went to see my doctor""","Dokter maubati pasien, tabib maulah ubat tradisional",,
18913,Weapon_25385 ,NOUN,gun,pistul,,a weapon that discharges a missile at high velocity (especially from a metal tube or barrel),sanjata nang malapehkan piluru wan kacepatan tinggi,,,Manembak lawan pistul,,
4302,Bodily process_71350 ,NOUN,breath,nangas,,the process of taking in and expelling air during breathing,proses maambil wan mangaluarkan udara,,"""he took a deep breath and dived into the pool""; ""he was fighting to his last breath""",Nangas urang,,
12708,Cattle_12704 ,NOUN,bull,banteng,,uncastrated adult male of domestic cattle,lembu hitam,,,banteng ternak,,
12709,Cattle_12704 ,NOUN,"cow, moo-cow",sapi,,female of domestic cattle,hewan ternak wan mamalia,,"""`moo-cow' is a child's term""",susu sapi,,
39709,Sound_39620 ,NOUN,noise,suara bising,,sound of any kind (especially unintelligible or dissonant sound),"bunyi nang dikaluarakan dari mulut manusia,suara urang banyak ",,"""he enjoyed the street noises""; ""they heard indistinct noises of people talking""; ""during the firework display that ended the gala the noise reached 98 decibels""","Suara merdu, suara kendaraan nang bising",,
46010,Political administrative division_118009 Administrative district_45808 ,NOUN,"country, state, land","nagara, tanah",,the territory occupied by a nation,"organisasi dalam suatu wilayah nang baisi kakuasaan tatinggi, parmukaan bumi ",,"""he returned to the land of his birth""; ""he visited several European countries""","Nagara makmur, tanah pamarintah ",,
41763,Vegetable_41672 ,NOUN,onion,bawang ,,an aromatic flavorful bulb,jenis bawang nang babantuk bulat ganal,,,Keripik rasa bawang bombai,,
21023,Loop_73766 ,NOUN,"noose, running noose, slip noose",jerat,,a loop formed in a cord or rope by means of a slipknot; it binds tighter as the cord or rope is pulled,tali nang hujungnya disimpulakan mambantuk lubang nang kawa disempit,,,Jerat nang terlalu kuat,,
14816,Container_16731 ,NOUN,bag,kampil,,a flexible container with a single opening,kemasan babantuk sagi ampat wan dipakai gasan manyimpan ,,"""he stuffed his laundry into a large bag""",Mambawa kampil ganal,,
16900,Baby bed_14771 ,NOUN,cradle,buaian ,,a baby bed with sides and rockers,ranjang nang babantuk kaya ayunan wan digantung di kadua hujungnya ,,,Buaian bayi,,
35605,Information_35569 ,NOUN,news,habar,,new information of any kind,kisah manganai kajadian nang hangat ,,"""it was news to me""",Habar pambunuhan,,
12762,Bovid_12698 ,NOUN,sheep,domba,,woolly usually horned ruminant mammal related to the goat,kambing nang babuluan tebal,,,Domba hirang ,,
39762,Noise_39709 ,NOUN,thunder,guntur ,,a booming or crashing noise caused by air expanding along the path of a bolt of lightning,suara manggigir di udara ,,,Bunyi guntur keras banar,,
23149,Support_24175 ,NOUN,shelf,rak,,a support that consists of a horizontal surface for holding objects,wadah nang berfungsi gasan manyimpan barang-barang ,,,Rak buku,,
46087,Residence_46085 ,NOUN,"home, place","rumah, wadah",,where you live at a particular time,"bangunan gasan wadah tinggal, ruang nang ditinggali, sesuatu nang dipakai gasan menaruh ",,"""deliver the package to my home""; ""he doesn't have a home to go to""; ""your place or mine?""",Dari wadah sidin ke rumah ikam ,,
57848,Kinsman_54911 GAP_120043 ,NOUN,uncle,paman ,,the brother of your father or mother; the husband of your aunt,"ading abah, laki acil",,,"paman Budi, paman Rahman",,
27306,Tendency_27301 ,NOUN,desire,kahandak,,an inclination to want things,"bakahandak, mangahandaki",,"""a man of many desires""","bekahandak mainan, kahandakan bajalan",,
16950,Tableware_24297 ,NOUN,"crockery, dishware",paralatan makan,,tableware (eating and serving dishes) collectively,alat makan,,,"sinduk, garpu, piring, galas",,
19024,Appendage_14559 ,NOUN,"handle, grip, handgrip, hold",mandangani,,the appendage to an object that is designed to be held in order to use or move it,"bapingkut, mangganii",,"""he grabbed the hammer by the handle""; ""it was an old briefcase but it still had a good grip""","bapingkut di tihang, mandangani bajalan",,
46114,Boundary_45906 ,NOUN,end,ampih,,a boundary marking the extremities of something,"baampih, maampihi, tuntung",,"""the end of town""","ampih acara, tuntung makan",,
23181,Garment_18608 ,NOUN,shirt,baju kamija,,a garment worn on the upper half of the body,baju rasmi,,,baju bakarah,,
23191,Footwear_18387 ,NOUN,shoe,sapatu,,footwear shaped to fit the foot (below the ankle) with a flexible upper of leather or plastic and a sole and heel of heavier material,gasan dipakai sapatu,,,mamakai sapatu,,
39819,Flow_39815 ,NOUN,"current, stream","wahini, sungai halus",,a steady flow (usually from natural causes),"wahinian, tampat gasan urang bakudak",,"""the raft floated downstream on the current""; ""he felt a stream of air""","makan wahinian, bakudak di sungai halus",,
41875,Rind_41424 ,NOUN,"peel, skin",manguyak,,the rind of a fruit or vegetable,"manguyak buah, kuyak akan",,,"manguyak mangga, kuyak akan pisang",,
46138,Grassland_46279 ,NOUN,"hayfield, meadow",padang gayang,,a field where grass or alfalfa are grown to be made into hay,gasan sapi,,,tampat guring sapi,,
333,Nonaccomplishment_305 ,NOUN,"mistake, error, fault",sebuah kesalahan,,a wrong action attributable to bad judgment or ignorance or inattention,gasan nang salah kita laku akan,,"""he made a bad mistake""; ""she was quick to point out my errors""; ""I could understand his English in spite of his grammatical faults""","salah bapandir, salah makanan, salah bajalan",,
41880,Edible fruit_41671 Pome_69676 ,NOUN,apple,apel,,fruit with red or yellow or green skin and sweet to tart crisp whitish flesh,"buah nang warna habang, hijau, kuning",,,"apel halus, apel ganal",,
25297,Article_125 ,NOUN,ware,GAP,,"articles of the same kind or material; usually used in combination: `silverware', `software'",,,,,,
23209,Mercantile establishment_20554 ,NOUN,"shop, store",tuku,,a mercantile establishment for the retail sale of goods or services,tampat gasan babalanja,,"""he bought it at a shop on Cape Cod""","tuku baju, tuku buku",,
55844,Ruler_56680 ,NOUN,"overlord, master, lord",tuan urang,,a person who has general authority over others,sambatan gasan nang baisi tanah,,,"tuan tanah,  tuan  amas",,
41907,Edible fruit_41671 ,NOUN,berry,buah beri,,any of numerous small and pulpy edible fruits; used as desserts or in making jams and jellies and preserves,"sajanis buah bulat halus, bisa jua dijadi akan selai",,,"selai beri, buah beri",,
79657,Lipid_79495 ,NOUN,oil,minyak,,a slippery or viscous liquid or liquefiable substance not miscible with water,"haharuman gasan awak, gasan maurut, gasan mangguring",,,"minyak harum,minyak lamak, minyak bintang",,
23240,Hand tool_19041 ,NOUN,shovel,singkrung,,a hand tool for lifting loose material; consists of a curved container or scoop and a handle,alat gasan mengambil pasir wan tanah,,,"singkrung pasir, singkrung samin",,
73522,Cardinal compass point_73521 ,NOUN,"north, due north, northward, n",utara,,the cardinal compass point that is at 0 or 360 degrees,arah mata angin,,,gasan manamuakan jalan bulik,,
31487,Imagination_31483 ,NOUN,"dream, dreaming",bamimpi,,a series of mental images and emotions occurring during sleep,"bamimpi guring, tamimpi",,"""I had a dream about you last night""",tamimpi guring,,
73531,Cardinal compass point_73521 ,NOUN,"east, due east, eastward, e",timur,,the cardinal compass point that is at 90 degrees,arah mata angin,,,timur laut,,
12895,Deer_12877 ,NOUN,"elk, european elk, moose, alces alces",GAP,,large northern deer with enormous flattened antlers in the male; called `elk' in Europe and `moose' in North America,,,,,,
17049,Container_16731 Crockery_16950 ,NOUN,cup,"galas, cangkir",,a small open container usually used for drinking; usually has a handle,banda nang digunakan gasan minum,,"""he put the cup back in the saucer""; ""the handle of the cup was missing""","galas kopi, galas teh",,
73539,Cardinal compass point_73521 ,NOUN,"south, due south, southward, s",selatan,,the cardinal compass point that is at 180 degrees,arah mata angin,,,pantai selatan,,
10843,Canine_10839 ,NOUN,"dog, domestic dog, canis familiaris","anjing, ",,a member of the genus Canis (probably descended from the common wolf) that has been domesticated by man since prehistoric times; occurs in many breeds,hewan nang rancak diharagu urang,,"""the dog barked all night""","anjing liar, anjing domestk",,
73547,Cardinal compass point_73521 ,NOUN,"west, due west, westward, w",barat,,the cardinal compass point that is a 270 degrees,"arah mata angin, manunjuk akan arah",,,Barat daya,,
55898,Genitor_54240 ,NOUN,parent,kuitan,,a father or mother; one who begets or one who gives birth to or nurtures and raises a child; a relative who plays the role of guardian,"abah wan mama, nang melahirkan wan membesar akan",,,"abah, mama, kuitan nang penyayang",,
25382,Artifact_124 ,NOUN,way,jalan,,any artifact consisting of a road or path affording passage from one place to another,bajalan ka tampat lain,,"""he said he was looking for the way out""","bajalan, papan jalan",,
46242,Habitation_46177 ,NOUN,"lair, den",sarang,,the habitation of wild animals,tampat tinggalnya hewan liar,,,"Sarang burung walet,sarang tikus",,
12940,Animal foot_11261 ,NOUN,paw,mangais,,a clawed foot of an animal especially a quadruped,"mancari makanan dengan cara manggaruk, mangais tanah",,,"hayam, burung",,
71545,Combustion_71396 ,NOUN,"fire, flame, flaming",api,,the process of combustion of inflammable materials producing heat and light and (often) smoke,"gasan mambakar, panas",,"""fire was one of our ancestors' first discoveries""","baapi, mangapi",,
33609,Communication_145 ,NOUN,message,pasan,,a communication (usually brief) that is written or spoken or signaled,mahabari kabar besuara wan nang tatulis,,"""he sent a three-word message""","pasan  singkat, pasan penting, pasan papadahan",,
25424,Excavation_17930 ,NOUN,well,sumur,,a deep hole or shaft dug or drilled to obtain water or oil or gas or brine,lubang nang dalam digali gasan mendapat banyu atau minyak,,,sumur batu,,
6815,Process_29989 ,NOUN,horn,tanduk,,one of the bony outgrowths on the heads of certain ungulates,"alat kesan mangdu ka hewan buas nang lain, cungul di kapala",,,"tanduk rusa, tanduk sapi, tanduk kambing",,
44186,Group_141 ,NOUN,"citizenry, people",urang,,the body of citizens of a state or country,"urang, manusia",,"""the Spanish people""","urang tuha, banyak urang",,
37905,Musical composition_37841 ,NOUN,"song, vocal","lagu, suara, babunyian",,a short musical composition with words,"musik handap nang dibabunyikan basuara, bakata-kata",,"""a successful musical must have at least three good songs""","madihin, lagu banjar",,
21286,Oar_21069 ,NOUN,"paddle, boat paddle",kayuh,,a short light oar used without an oarlock to propel a canoe or small boat,gasang mangayuh jukung,,,kayuh jukung,,
8881,Diapsid_8523 ,NOUN,"snake, serpent, ophidian",ular,,limbless scaly elongate reptile; some are venomous,hewan nang melata,,,"ular sawah, ular kobra",,
21298,Coloring material_79761 Coating_16533 ,NOUN,paint,cat,,a substance used as a coating to protect or decorate a surface (especially a mixture of pigment suspended in a liquid); dries to form a hard coating,gasan mewarnai banda atau rumah,,,"cat rumah, cat dinding",,
23366,Runner_22734 ,NOUN,ski,ski,,narrow wood or metal or plastic runners used in pairs for gliding over snow,papan kayu atau wasi nang sempit gasan maluncur di atas salju,,,ski salju,,
27513,Sound property_27518 ,NOUN,"silence, quiet","baranai, hinip",,the absence of sound,"kada babunyi, kada bagarak",,"""he needed silence in order to sleep""; ""the street was quiet""","Bahinip, baranai",,
69557,Woody plant_69553 ,NOUN,tree,pohon,,a tall perennial woody plant having a main trunk and branches forming a distinct elevated crown; includes both gymnosperms and angiosperms,tanaman,,,"Pohon nyiur, pohon limau, pohon tiwadak",,
15089,Furniture_18530 ,NOUN,bed,tilam,,a piece of furniture that provides a place to sleep,tampat guring,,"""he sat on the edge of the bed""; ""the room had only a bed and chair""","tilam kapuk, tilam busa",,
46378,Grassland_46279 ,NOUN,"pasture, pastureland, grazing land, lea, ley","halalang, padang kumpay",,a field covered with grass or herbage and suitable for grazing by livestock,kumpay badaun tajam,,,padang kumpay,,
29577,Internal organ_29110 ,NOUN,liver,hati,,large and complicated reddish-brown glandular organ located in the upper right portion of the abdominal cavity; secretes bile and functions in metabolism of protein and carbohydrate and fat; synthesizes substances involved in the clotting of the blood; synthesizes vitamin A; detoxifies poisonous substances and breaks down worn-out erythrocytes,"organ dalam awak, ",,,"hati hayam, hati manusia, hati sapi",,
33680,Press_33660 ,NOUN,"newspaper, paper","koran, karatas",,a daily or weekly publication on folded sheets; contains news and articles and advertisements,"gasan dibaca, gasan manulis",,"""he read his newspaper at breakfast""","karatas buku, koran, karatas karton",,
46388,Topographic point_46614 Continental elevation_118025 ,NOUN,"peak, crown, crest, top, tip, summit",puncak,,the top point of a mountain or hill,di atas parmukaan laut,,"""the view from the peak was magnificent""; ""they clambered to the summit of Monadnock""",puncak gunung,,
23403,Block_15301 ,NOUN,slab,lempeng,,block consisting of a thick piece of something,gasan bangunan,,,"batu bata, batako",,
53958,Parent_55898 ,NOUN,"father, male parent, begetter",abah,,a male parent (also used as a term of address to your father),kuitan lalaki,,"""his father was born in Atlanta""","abah, kai, amang",,
29594,Internal organ_29110 ,NOUN,"heart, pump, ticker",jantung,,the hollow muscular organ located behind the sternum and between the lungs; its rhythmic contractions move the blood through the body,"organ dalam awak, gasan mengalir akan darah ke seluruh awak",,"""he stood still, his heart thumping wildly""",jantung manusia,,
23416,Vehicle_25142 ,NOUN,"sled, sledge, sleigh",papan luncur,,a vehicle mounted on runners and pulled by horses or dogs; for transportation over snow,gasan baramian di atas salju,,,papan luncur,,
46408,Point_46401 ,NOUN,"position, place",tampat,,the particular portion of space occupied by something,manunjuk akan kata tampat,,"""he put the lamp back in its place""","tampat bakunyung, tampat balanja",,
23422,Cloth covering_16490 ,NOUN,"sleeve, arm","tangan baju, langan baju",,the part of a garment that is attached at the armhole and that provides a cloth covering for the arm,"kawa handap, kawa panjang",,,"langan baju panjang, langan baju pendek, langan jaket",,
53979,Female_51294 ,NOUN,"female child, girl, little girl",diyang,,a youthful female person,kakanakan halus binian,,"""the baby was a girl""; ""the girls were just learning to ride a tricycle""",ading binian,,
25515,Framework_18451 ,NOUN,window,lalungkang,,a framework of wood or metal that contains a glass windowpane and is built into a wall or roof to admit light or air,"gasan rumah kada kapanasan, gasan cahaya matahari masuk ka rumah, gasan kada humap",,,"lalungkang rumah, lalungkang kos",,
69604,Plant organ_69474 ,NOUN,root,akar,,(botany) the usually underground organ that lacks buds or leaves or nodes; absorbs water and mineral salts; usually it anchors the plant to the ground,nang di bawah tanah atau banyu,,,"akar  kayu jati, akar  taratai",,
73703,Shape_133 ,NOUN,line,garis,,a length (straight or curved) without breadth or thickness; the trace of a moving point,gasan mambatasi,,,garis tanah,,
15145,Accessory_14252 ,NOUN,belt,pendeng,,a band to tie or buckle around the body (usually at the waist),gasan salawar kada lului,,,pendeng kulit,,
29628,Internal organ_29110 ,NOUN,"stomach, tummy, tum, breadbasket",parut,,an enlarged and muscular saclike organ of the alimentary canal; the principal organ of digestion,bagian awak,,,"parut lamak, parut kurus",,
19295,Implement_19475 ,NOUN,hook,"kabam, pasuran",,a curved or bent implement for suspending or pulling something,gasan maunjun iwak,,,unjun,,
77816,Noble metal_77762 ,NOUN,"gold, au, atomic number 79",amas,,a soft yellow malleable ductile (trivalent and univalent) metallic element; occurs mainly as nuggets in rocks and alluvial deposits; does not react with most chemicals but is attacked by chlorine and aqua regia,gasan perhiasan,,,"kalung amas, gelang amas, cincin amas",,
11027,Canine_10839 ,NOUN,wolf,"anjing, duyuk",,any of various predatory carnivorous canine mammals of North America and Eurasia that usually hunt in packs,binatang melolong,,,anjing hutan,,
17242,Decoration_17189 ,NOUN,"design, pattern, figure",hiasan gasan rumah,,a decorative or artistic work,"gasan menghiasi rumah, mendekor",,"""the coach had a design on the doors""","jambangan, kaligrafi",,
58144,Woman_58189 Spouse_57259 ,NOUN,"wife, married woman",bini,,a married woman; a man's partner in marriage,pasangan laki,,,sudah nikah,,
29649,Liquid body substance_29637 ,NOUN,blood,darah,,the fluid (red in vertebrates) that is pumped by the heart,mangalir dalam awak,,"""blood carries oxygen and nutrients to the tissues and carries waste products away""; ""the ancients believed that blood was the seat of the emotions""","darah kotor, darah habang, darah putih",,
77833,Metallic element_77761 ,NOUN,"iron, fe, atomic number 26",wasi,,a heavy ductile magnetic metallic element; is silver-white in pure form but readily rusts; used in construction and tools and armament; plays a role in the transport of oxygen by the blood,"gasan maulah seng, gasan maulah banda wasi",,,"wasi motor, wasi hatap rumah, wasi bubungan",,
69641,Leaf_69751 ,NOUN,"blade, leaf blade",daun,,especially a leaf of grass or the broad portion of a leaf as distinct from the petiole,bagian tanaman,,,"daun singkong, daun pohon",,
21410,Object_108 ,NOUN,"part, portion","porsi, bagian",,something less than the whole of a human artifact,sesuatu nang kurang dari awak manusia,,"""the rear part of the house""; ""glue the two parts together""",porsi makan,,
33764,Communication_145 ,NOUN,"language, linguistic communication",bahasa,,a systematic means of communicating by the use of sounds or conventional symbols,nang dipakai gasan bapandir,,"""he taught foreign languages""; ""the language introduced is standard throughout the text""; ""the speed with which a program can be executed depends on the language in which it is written""",bahasa banjar,,
31713,Content_31685 ,NOUN,"topic, subject, issue, matter","topik, pandir",,some situation or event that is thought about,situasi nang dibahas,,"""he kept drifting off the topic""; ""he had been thinking about the subject for several years""; ""it is a matter for the police""",papandiran,,
11053,Canine_10839 ,NOUN,fox,rubah,,alert carnivorous mammal with pointed muzzle and ears and a bushy tail; most are predators that do not hunt in packs,hewan hutan,,,rubah,,
73757,Shape_133 ,NOUN,circle,"lingkaran, bulatan",,something approximating the shape of a circle,sesuatu nang bulat,,"""the chairs were arranged in a circle""","hulahup, cincin",,
29676,Drop_73212 ,NOUN,"tear, teardrop",banyu mata,,a drop of the clear salty saline solution secreted by the lacrimal glands,nang kaluar pas manangis,,"""his story brought tears to her eyes""",banyu mata histeris,,
33780,Language unit_33769 ,NOUN,word,kata,,a unit of language that native speakers can identify,gabungan huruf,,"""words are the blocks from which sentences are made""; ""he hardly said ten words all morning""",kata,,
31732,Fact_31722 ,NOUN,truth,jujur,,a fact that has been verified,kata nang bujur,,"""at last he knew the truth""; ""the truth is that he didn't want to do it""","jujur, bujur",,
11070,Feline_11068 ,NOUN,"cat, true cat",kucing,,feline mammal usually having thick soft fur and no ability to roar: domestic cats; wildcats,hewan bebulu,,,"kucing ganal, kucing garong",,
65581,Tree_69557 ,NOUN,"birch, birch tree",GAP,,any betulaceous tree or shrub of the genus Betula having a thin peeling bark,,,,,,
58189,Adult_51236 Female_51294 ,NOUN,"woman, adult female",galuh,,an adult female person (as opposed to a man),binian tuha,,"""the woman kept house while the man hunted""",pasangannya nanang,,
21444,Way_25382 ,NOUN,path,jalur,,a way especially designed for a particular use,arah jalan,,,jalur tikungan,,
54068,Rival_56628 ,NOUN,"foe, enemy",musuh,,a personal enemy,nang kada bakawan,,"""they had been political foes for years""",musuh dalam selimut,,
77883,Noble metal_77762 Conductor_78802 ,NOUN,"silver, ag, atomic number 47",pirak,,a soft white precious univalent metallic element having the highest electrical and thermal conductivity of any metal; occurs in argentite and in free form; used in coins and jewelry and tableware and photography,"lugam nang bawarna putih tipis, rajin dipakai gasan maulah koin atawa parhiasan ",,,"""aku baisi galang pirak, bagus banar galang piraknya""",,
19369,Dwelling_17703 Building_15668 ,NOUN,house,rumah,,a dwelling that serves as living quarters for one or more families,tampat gasan urang tinggal,,"""he has a house on Cape Cod""; ""she felt she had to get out of the house""","""inya baisi rumah di Kandangan"", ""inya handak kaluar pada rumah""",,
79945,Soil_78939 ,NOUN,sand,karangan,,a loose material consisting of grains of rock or coral,banda babantuk babutir halus,,,"""bakarangan banar batisku nah""",,
54098,Supervisor_57473 ,NOUN,"foreman, chief, gaffer, honcho, boss","mandur, bos",,a person who exercises control over workers,urang nang mangawasi/mangatur ,,"""if you want to leave early you have to ask the foreman""","""mun ikam handak bulik badahulu, ikam bapadah dahulu ka mandur""",,
27685,Coldness_27684 ,NOUN,"chill, iciness, gelidity","dingin, dingin banar",,coldness due to a cold environment,kadinginan ,,,"""dingin banar di sini""",,
29734,Blood vessel_29730 ,NOUN,"vein, vena, venous blood vessel",pambuluh darah,,a blood vessel that carries blood from the capillaries toward the heart,urgan di awak nang mambawakan darah ka saluruh awak,,"""all veins except the pulmonary vein carry unaerated blood""","""pambuluh darah bafungsi gasan manjalanakan darah di awak""",,
13191,Primate_13117 ,NOUN,monkey,warik,,any of various long-tailed primates (excluding the prosimians),hiwan (primata) nang baisi buntut panjang,,,"""wariknya mamakan pisang""",,
11134,Carnivore_10793 ,NOUN,bear,biruang,,massive plantigrade carnivorous or omnivorous mammals with long shaggy coats and strong claws,"hiwan ganal pamakan daging, babulu labat wan baisi cakar ganal",,,"""aku malihat biruang ganal lalu, tadi di hutan""",,
27700,Physical property_27656 ,NOUN,"luminosity, brightness, brightness level, luminance, luminousness, light",tarang/katarangan/kacarahan,,the quality of being luminous; emitting or reflecting light,kualitas cahaya nang dipancarakan,,"""its luminosity is measured relative to that of our sun""","""cahaya lampunya tarang banar""",,
9091,Arachnid_9075 ,NOUN,spider,kabibitak,,predatory arachnid that usually has silk-spinning organs at the back end of the body; they spin silk to make cocoons for eggs or traps for prey,hiwan nang bisa mamintal banang gasan maulah kapumpung manaruh intalu atawa jabakan gasan mangsanya.,,,"""banyak banar kabibitak di rumah niniku""",,
31804,Negative stimulus_31783 ,NOUN,"grief, sorrow",kasadihan/sadih,,something that causes great unhappiness,sasuatu nang maulah sadih,,"""her death was a great grief to John""","""Amat kasadihan banar bakas kamatian pamannya""",,
31805,Content_31685 ,NOUN,"idea, thought","pandapat, pamikiran",,the content of cognition; the main thing you are thinking about,inti dari pamikiran,,"""it was not a good idea""; ""the thought never entered my mind""","""itu lain pandapat nang bagus"", ""pamikiranku baiknya kita singgah dahulu ka warung hanyar batarus tulak""",,
46567,Political administrative division_118009 Administrative district_45808 ,NOUN,"state, province",parupinsi,,the territory occupied by one of the constituent administrative districts of a nation,wilayah nang ditampati ulih salah satu bagian administratif nagara,,"""his state is in the deep south""","""nagaranya di subalah salatan"", ""inya dari parupinsi kalimantan salatan""",,
15283,Bedclothes_15094 ,NOUN,"blanket, cover",salimut,,bedding that keeps a person warm in bed,banda gasan maulah awak hangat,,"""he pulled the covers over his head and went to sleep""","""inya kadinginan makanya guring bakalubut salimut""",,
67707,Tree_69557 ,NOUN,"willow, willow tree",puhun dedalu,,any of numerous deciduous trees and shrubs of the genus Salix,salah satu janis puhun wan samak paluruh dari genus salix,,,"""Lihati puhun dedalu ngitu, labat banar daunnya""",,
46590,Point_46401 ,NOUN,corner,buncu,,the point where three areas or surfaces meet or intersect,hujung tampat atau banda,,"""the corners of a cube""","""buncu dari kubus"", ""andak tas ikam di buncu kamar""",,
31829,Category_31828 ,NOUN,"kind, sort, form, variety","janis, macam, bantuk",,a category of things distinguished by some common characteristic or quality,macam atau janis banda,,"""sculpture is a form of art""; ""what kinds of desserts are there?""","""patung marupakan bantuk dari seni"", ""apa haja janis wadai nang ada ni?"", ""banyak macamnya wadai di sini lah cil""",,
54154,Person_118 ,NOUN,friend,kawan,,a person you know well and regard with affection and trust,urang nang dikanal/patuh banar,,"""he was my best friend at the university""","""inya kawan baik aku di sakulahan""",,
