cave,a geological formation consisting of an underground enclosure with access from the surface of the ground or from the sea,mağara,"Bir yamaca veya kaya içine doğru uzanan, barınak olarak kullanılabilen yer kovuğu."
"recuperate, recover, convalesce",get over an illness or shock,"iyileşmek, toparlanmak","Hastalıktan kurtulmak, sağlığı yerine gelmek."
fly,two-winged insects characterized by active flight,sinek,"Çift kanatlılardan, birtakım uçucu böceklerin genel adı."
sign,a public display of a (usually written) message,tabela,"Üzerinde tanıtıcı, belirtici bir yazı, açıklama, işaret veya resim bulunan nesne."
"interrupt, disturb",destroy the peace or tranquility of,"kesmek, bölmek, rahatsız etmek, bozmak","Rahatını bozmak, rahatını, keyfini kaçırmak."
"kettle, boiler",a metal pot for stewing or boiling; usually has a lid,kazan,"Çok miktarda yemek pişirmeye veya bir şey kaynatmaya yarayan büyük, derin kap."
"hark back, return, come back, recall",go back to something earlier,geri dönmek,geldiği yere gitmek
"translate, interpret, render",restate (words) from one language into another language,"çevirmek, tercüme etmek,",bir dilden başka bir dile aktarmak
"crisscross, cross, mark",a marking that consists of lines that cross each other,çarpı,Birbiriyle çarpılan iki sayı arasına konulan işaret: axb.
cloud,a visible mass of water or ice particles suspended at a considerable altitude,bulut,"Atmosferdeki su damlacıkları ve buz taneciklerinin görülebilir yoğunluk kazanmasıyla oluşan, biçimleri, yükseklikleri ve yol açtıkları hava olaylarıyla birbirinden ayrılan yığın."
butter,an edible emulsion of fat globules made by churning milk or cream; for cooking and table use,"tereyağı, sağyağ, sadeyağ, sarı yağ",Sütten çıkarılan yemeklik yağ.
broom,a cleaning implement for sweeping; bundle of straws or twigs attached to a long handle,süpürge,Süpürme işinde kullanılan araç.
"connect, link, tie, link up","connect, fasten, or put together two or more pieces","bağlamak, birleştirmek, kenetlemek","İp, bağ veya başka bir araçla bir şeyi bir yere veya birkaç şeyi birbirine tutturmak, birleştirmek."
listen,hear with intention,dinlemek,İşitmek için kulak vermek.
hear,perceive  (sound) via the auditory sense,duymak,"İşitmek, ses almak."
"talk, speak",exchange thoughts; talk with,"konuşmak, laflamak","Bir konuda karşılıklı söz etmek, sohbet etmek."
"aunt, auntie, aunty",the sister of your father or mother; the wife of your uncle,"teyze, hala","Annenin kız kardeşi, ana yarısı, anne yarısı; babanın kız kardeşi."
"troop, flock",an orderly crowd,"birlik, sürü, grup, topluluk ",Görev bakımından birbirini tamamlayan kimselerin topluluğu.
stroke,a mark made by a writing implement (as in cursive writing),"vuruş, darbe",Vurma işi
"speak, talk",use language,konuşmak,Konuşma dili olarak kullanmak.
stick,a long thin implement resembling a length of wood,çubuk,"Körpe dal; değnek biçiminde ince, uzun ve sert olan şey."
"bucket, pail",a roughly cylindrical vessel that is open at the top,kova,"Genellikle su ve sulu şeyler taşımaya, kuyudan veya denizden su çekmeye yarayan üstünden kulplu kap."
"make noise, resound, noise",emit a noise,"gürültü çıkarmak, yankılanmak",düzensiz ve rahatsız edici sesler çıkarmak
perch,any of numerous spiny-finned fishes of various families of the order Perciformes,levrek,"Levrekgillerden, eti beyaz, üzeri pullu iri bir balık (Labrax labrax)."
"edge, margin",a strip near the boundary of an object,"kenar, sınır",Bir şeyi çevreleyen çizgi.
"animation, life, living, aliveness",the condition of living or the state of being alive,"canlılık, canlı, dirilik, diri, hayat, yaşam","Yaşamakta olan, yaşayan."
mosquito,two-winged insect whose female has a long proboscis to pierce the skin and suck the blood of humans and animals,sivrisinek,"Çift kanatlılardan, sulak, bataklık yerlerde çok üreyen, insan ve memeli hayvanların kanıyla beslenen, birçok türü bulunan ve bir türü sıtma mikrobu aşılayan ve bulaşıcı hastalıkları yayan uçucu böcek (Culexpipiens)."
pole,a long (usually round) rod of wood or metal or plastic,direk,Ağaçtan veya demirden yapılan uzun ve kalın destek.
"affect, impress, move, strike",have an emotional or cognitive impact upon,"etkilemek, tesir etmek",Etkiye uğratmak
be,"have the quality of being; (copula, used with an adjective or a predicate noun)",olmak,"Meydana gelmek, vuku bulmak"
paint,apply paint to; coat with paint,boyamak,Boya sürerek veya boyaya batırarak renk vermek.
pike,any of several elongate long-snouted freshwater game and food fishes widely distributed in cooler parts of the northern hemisphere,turna balığı,Tatlı sularda yaşayan yırtıcı bir balık (Esox lucius).
knife,edge tool used as a cutting instrument; has a pointed blade with a sharp edge and a handle,bıçak,"Kesme işlerinde kullanılan, bir sap ve çelik bölümden oluşan kesici araç."
"meaning, substance",the idea that is intended,"anlam, içerik","Sözlü veya yazılı anlatımda verilmek istenen öz, düşünce, duygu ve imgelerin bütünü."
"end, stop, finish, terminate, cease","have an end, in a temporal, spatial, or quantitative sense; either spatial or metaphorical","sonlandırmak, bitirmek, durdurmak, sona erdirmek","tamamlamak, sonuçlandırmak."
"disturb, upset, trouble",move deeply,"üzmek, canını sıkmak, rahatsız etmek","kişinin neşesi kaçması, huzurunun bozulması"
"ring, peal",sound loudly and sonorously,"çınlamak, çalmak",Yankı vermek.
size,the physical magnitude of something (how big it is),"boyut, ebat","Cisme ait uzunluğun, derinliğin ve genişliğin ifade ettiği bütün."
"bundle, sheaf",a package of several things tied together for carrying or storing,"demet, deste, tomar",Aynı şeyin bir küme oluşturacak tarzda bir araya gelmiş biçimi.
chime,emit a sound,"Çınlamak, çalmak","""Çın"" diye ses çıkarmak; ses çıkarmak, ses vermek."
rustle,make a dry crackling sound,hışırdamak,"Kâğıt, kumaş, kuru yaprak vb. nesneler birbirlerine sürtünürken, buruşturulurken ""hışır"" diye ses çıkarmak."
honey,a sweet yellow liquid produced by bees,bal ,"Bal arılarının bitki ve çiçeklerden topladıkları bal özünden yapıp kovanlarındaki petek gözlerine doldurdukları, rengi beyazdan esmere kadar değişen tatlı, koyu, sıvı madde."
knot,any of various fastenings formed by looping and tying a rope (or cord) upon itself or to another rope or to another object,"düğüm, boğum","İplik, ip, halat vb. bükülebilir şeyleri kıvırıp kendi üzerine veya birbirine dolayarak yapılan boğum."
love,be enamored or in love with,sevmek,Sevgi ve bağlılık duymak
"be, live","have life, be alive","var olmak, sağ olmak, yaşamak","sağ olmak, yaşamak."
wood,the hard fibrous lignified substance under the bark of trees,odun,"Bitkilerde besi suyunu ileten damarlarla bunlara eşlik eden özek doku ve liflerden oluşan, aynı zamanda bitkiye destek görevi yapan madde."
like,find enjoyable or agreeable,hoşlanmak,"Hoşuna gitmek, hoş bulmak."
"tinkle, tink, clink, chink",make or emit a high sound,"şıngırdamak, tokuşturmak, şangırdatmak, şargırdamak","Tabak, bardak, şişe vb.nin bir yere veya birbirine çarparken, kırılırken ses çıkarması veya yayması veya yağmur, rüzgar gibi olayların bir yere çarparak yüksek ses çıkarması."
"stove, kitchen stove, range, kitchen range, cooking stove",a kitchen appliance used for cooking food,"ocak, fırın, kuzine, fırınlı ocak, mutfak sobası, ","Isı vererek üzerine veya içine konulan maddeleri ısıtan, pişiren, kaynatan, eriten araç veya alet."
duck,small wild or domesticated web-footed broad-billed swimming bird usually having a depressed body and short legs,ördek,"Perde ayaklılardan, evcil ve yabani türleri bulunan su kuşu; badi, badik (Anas)."
"board, plank",a stout length of sawn timber; made in a wide variety of sizes and used for many purposes,tahta,"Çeşitli işlerde kullanılmak üzere düz, enlice, uzun ve az kalın biçimde işlenmiş ağaç parçası."
kick,strike with the foot,tekmelemek,"Tekme vurmak, tekme atmak; tepiklemek."
"fear, dread",be afraid or scared of; be frightened of,"korkmak, ödü kopmak","Korku duymak, ürkmek, dehşete kapılmak; korkulmak."
ladder,steps consisting of two parallel members connected by rungs; for climbing up or down,merdiven,Bir yere çıkmaya veya bir yerden inmeye yarayan basamaklar dizisi.
fear,be afraid or feel anxious or apprehensive about a possible or probable situation or event,"korkmak, endişelenmek","Kaygı duymak, endişe etmek."
"strap, shoulder strap",a band that goes over the shoulder and supports a garment or bag,kayış,"Bağlamak, tutmak veya sıkmak amacıyla kullanılan, dar ve uzun kösele dilimi."
"change, alter, vary","make or become different in some particular way, without permanently losing one's or its former characteristics or essence","değişmek, dönüşmek, farklılık göstermek",Başka bir biçim veya duruma girmek.
through,in diameter,çap,Cisimlerin genişliği
"foam, froth",a mass of small bubbles formed in or on a liquid,"köpük, köpürme","Sabun, deterjan vb.nin suda erimesinden oluşan beyaz kabarcık veya çalkanan, kaynatılan, mayalanan, yukarıdan dökülen sıvıların üzerinde oluşan hava kabarcıkları yığını."
wool,fiber sheared from animals (such as sheep) and twisted into yarn for weaving,yün,Yün bazı memelilerden elde edilen hayvansal kıl kökenli doğal bir elyaf türü.
"food, solid food",any solid substance (as opposed to liquid) that is used as a source of nourishment,"besin, yiyecek, katı yiyecek","Yenilebilir, beslenmeye elverişli her tür madde."
tomorrow,"the next day, the day after, following the present day",yarın,Bugünden sonra gelecek ilk gün.
"change, alter, modify",cause to change; make different; cause a transformation,"değiştirmek, dönüştürmek, modifye etmek, kişiselleştirmek","Başka bir biçime sokmak, değişikliğe uğratmak."
dish,a particular item of prepared food,yemek,Yenmek için pişirilip hazırlanmış yiyecek.
"character, grapheme, graphic symbol",a written symbol that is used to represent speech,"karakter, yazı birimi, grafem, grafik sembol",herhangi bir dilin bir yazı sisteminin en küçük birimidir.
"recognize, recognise, distinguish, discern, pick out, make out, tell apart",detect with the senses,"tanımak, fark etmek, farkına varmak, ayırt etmek, anlamak, seçmek, ayırmak","Ne olduğunu anlamak, ayırt etmek."
hot,used of physical heat; having a high or higher than desirable temperature or giving off heat or feeling or causing a sensation of heat or burning,sıcak,"Isısı yüksek olan, çok ısınmış."
pot,metal or earthenware cooking vessel that is usually round and deep; often has a handle and lid,tencere,"İçinde yemek pişirilen, kapaklı, genellikle metal kap."
"taste, savor, savour",have flavor; taste of something,"tatmak, tadına bakmak",Dil yardımıyla bir şeyin tadının nasıl olduğunu anlamak.
button,a round fastener sewn to shirts and coats etc to fit through buttonholes,düğme,"iyecek, yorgan vb.nin bazı yerlerine ilikleyici veya süs olarak dikilen kemik, metal, sedef gibi sert maddelerden yapılmış küçük tutturma aracı."
memory,something that is remembered,"anı, hatıra",Geçmişte yaşanmış çeşitli olaylardan belleğin sakladığı her türlü iz.
"string, twine",a lightweight cord,sicim,"Keten, kenevir vb. bitkilerin liflerinden yapılan, kaba şeyleri dikmeye, bağlamaya yarayan ince ip."
"rain, rainfall",water falling in drops from vapor condensed in the atmosphere,"yağmur, yağış",Atmosferdeki su buharının yoğunlaşmasıyla oluşan ve yeryüzüne düşen yağışın sıvı durumda olanı.
"annoy, rag, get to, bother, get at, irritate, rile, nark, nettle, gravel, vex, chafe, devil","cause annoyance in; disturb, especially by minor irritations","sinirlendirmek, sinirini bozmak, canını sıkmak, sinir etmek, kızdırmak, gıcık etmek, tahrik etmek, öfkelendirmek, sinirden kudurtmak, küplere bindirmek, kıl etmek, illet olmak, cinleri tepesine çıkarmak","Duygu ve davranışlarını denetleyemeyecek duruma gelmek; asabileşmek, feveran etmek."
pouch,a small or medium size container for holding or carrying things,kese,"Cepte taşınan, içine para, tütün vb. konulan, kumaştan veya örgüden küçük torba."
write,communicate or express by writing,yazmak,öz ve düşünceyi özel işaret veya harflerle anlatmak.
"fever, febrility, febricity, pyrexia, feverishness",a rise in the temperature of the body; frequently a symptom of infection,"ateş, ateşlilik, yüksek ateş, humma, pireksi,  hararet",Genellikle hastalık etkisiyle artan vücut sıcaklığı; hastalıkla gelen şiddetli ateş.
"ant, emmet, pismire",social insect living in organized colonies; characteristically the males and fertile queen have wings during breeding season; wingless sterile females are the workers,karınca,"Zar kanatlılardan, toplu olarak yaşayan, yuvaları toprağın altında olan ve birçok türü bulunan böceklerin genel adı (Formica)."
leather,an animal skin made smooth and flexible by removing the hair and then tanning,deri,İşlenerek kullanılır duruma getirilmiş hayvan postu.
goose,web-footed long-necked typically gregarious migratory aquatic birds usually larger and less aquatic than ducks,kaz,"Perde ayaklılardan, genellikle beyaz veya boz renkli, uzun boyunlu, suda ve karada yaşayan, uçan, yabani veya evcil kuş (Anser)."
cold,used of physical coldness; having a low or inadequate temperature or feeling a sensation of coldness or having been made cold by e.g. ice or refrigeration,soğuk,"Isısı düşük olan, sıcak karşıtı."
"gather, garner, collect, pull together",assemble or get together,"toplamak, biriktirmek, bir araya getirmek",Toplayıp yığmak
give,transfer possession of something concrete or abstract to somebody,vermek,"Üzerinde, elinde veya yakınında olan bir şeyi birisine eriştirmek, iletmek."
shadow,shade within clear boundaries,gölge,Saydam olmayan bir cisim tarafından ışığın engellenmesiyle ışıklı yerde oluşan karanlık.
call,a request,çağrı,Birinin bir yere gelmesini isteme; davet.
"under, below",further down,"altında, aşağıda, alt, aşağı",Yere doğru
hole,an opening into or through something,delik,"Dar, küçük açıklık."
"keep, hold on",retain possession of,"tutmak, saklamak","Elinde bulundurmak, tutmak"
"happiness, felicity",state of well-being characterized by emotions ranging from contentment to intense joy,"mutluluk, saadet",Yaşadıklarından veya karşılaştıklarından dolayı hoşnutluk içinde bulunma durumu.
swan,stately heavy-bodied aquatic bird with very long neck and usually white plumage as adult,kuğu,"Perde ayaklılardan, yaban ve evcil türleri bulunan, çok uzun ve kıvrık boyunlu, geniş gagalı, geniş kanatlı bir su kuşu (Cygnus olor)."
"own, have, possess",have ownership or possession of,"sahip olmak, elinde bulundurmak",mülkiyetinde olmak
turn out,prove to be in the result or end,"sonuçlanmak, neticelenmek",bir işin bitmesi
"snow, snowfall",precipitation falling from clouds in the form of ice crystals,"kar, kar yağışı",Atmosferdeki su buharının yoğunlaşmasıyla oluşan ve yeryüzüne beyaz ve hafif billurlar biçiminde donarak düşen su buharı.
"buy, purchase",obtain by purchase; acquire by means of a financial transaction,"satın almak, almak",Bir nesneyi belirlenen fiyatını ödeyerek kendine mal etmek.
"become, go, get",enter or assume a certain state or condition,"girmek, geçmek, haline gelmek/girmek, dönmek, olmak","Durumdan duruma geçmek, değişmek, olduğundan daha değişik bir durum almak."
wait,stay in one place and anticipate or expect something,beklemek,"Bir iş oluncaya, biri gelinceye değin bir yerde kalmak, durmak."
"fail, betray","disappoint, prove undependable to; abandon, forsake","yüzüstü bırakmak, boşa çıkarmak, hayal kırıklığına uğratmak, ihanet etmek",beklenen bir durumda istenilen sonucun alınamaması
book,a written work or composition that has been published (printed on pages bound together),kitap,"Ciltli veya ciltsiz olarak bir araya getirilmiş, basılı veya yazılı kâğıt yaprakların bütünü."
"decrease, diminish, lessen, fall","decrease in size, extent, or range","azalmak, küçülmek, eksilmek, daralmak,  düşmek",Eskisinden az bir duruma gelmek.
"receive, have",get something; come into possession of,"teslim almak, almak, sahip olmak",kendisine verilen bir şeyi almak.
"get, acquire",come into the possession of something concrete or abstract,"edinmek, elde etmek, almak, sahip olmak",Kendini bir şeye sahip kılmak.
island,a land mass (smaller than a continent) that is surrounded by water,ada,Deniz veya göl suları ile çevrili kara parçası
"husband, hubby, married man",a married man; a woman's partner in marriage,"koca, eş, bey, er",Bir kadının evlendiği kişi.
"area, expanse, surface area",the extent of a 2-dimensional surface enclosed within a boundary,"alan, genişlik, yüzey alanı","Alan veya yüz ölçümü, bir yüzeyin uzayda kapladığı iki boyutlu yer miktarını ölçen bir büyüklüktür."
"meal, repast",the food served and eaten at one time,"yemek, öğün",Yemek vakti
length,the linear extent in space from one end to the other; the longest horizontal dimension of something that is fixed in place,uzunluk,İki nokta arasındaki yer aralığının ölçümü; bir yüzeyin iki temel boyutundan en büyük olanı.
"distance, length",size of the gap between two places,"uzaklık, mesafe, fersah",İki nokta arasındaki uzay ölçümü.
"head, caput",the upper part of the human body or the front part of the body in animals; contains the face and brains,"kafa, baş","Hayvanlarda genellikle ağız, göz, burun, kulak vb. organların bulunduğu vücudun en ön bölümü."
shake,bring to a specified condition by or as if by shaking,"sallamak, çalkalamak",Düzenli bir biçimde ve hep aynı doğrultuda hareket ettirmek.
"wipe, pass over",rub with a circular motion,"ovmak, üzerinden geçmek",Bir şeyin üzerine bastırarak el gezdirmek; bir yere bir şeyi kuvvetle sürterek temizlemek.
lake,a body of (usually fresh) water surrounded by land,göl,Karaların içinde denizlerle bağlantısı olmayan durgun su birikintisi
ash,the residue that remains when something is burned,kül,Yanan şeylerden artakalan toz madde.
increase,become bigger or greater in amount,artmak,çoğalmak
"land, ground, soil",material in the top layer of the surface of the earth in which plants can grow (especially with reference to its quality or use),"kara, arazi, toprak, zemin",Yeryüzünün denizle örtülü olmayan bölümü.
sweep,clean by sweeping,GAP,
"sweep, broom",sweep with a broom or as if with a broom,süpürmek,"Bir şeyin, bir yerin üstündeki çer çöp, toz toprak vb. şeyleri süpürge, fırça veya başka bir araçla toplamak, temizlemek."
"leash, tether, lead",restraint consisting of a rope (or light chain) used to restrain an animal,"tasma, yular, dizgin, kayış, zincir","Bazı hayvanların boynuna takılan, bu hayvanları bir yere bağlamaya, çekip götürmeye yarayan bağ"
hungry,feeling hunger; feeling a need or desire to eat food,"aç, acıkmış",Yemek yemesi gereken; tok karşıtı.
strong,having strength or power greater than average or expected,"güçlü, kuvvetli","Gücü, kuvveti olan."
jaw,the part of the skull of a vertebrate that frames the mouth and holds the teeth,çene,"Canlılarda baş bölümünde yer alan, kemik veya kıkırdak ile desteklenen, altlı üstlü dişleri taşıyan ve ağzın kapanıp açılmasını sağlayan kasları üzerinde barındıran iki parçaya verilen ad."
"height, tallness",the vertical dimension of extension; distance from the base of something to the top,"yükselik, boy","Geometrik biçimlerde, tabandan tepeye olan uzaklık."
mainland,the main land mass of a country or continent; as distinguished from an island or peninsula,"anakara, kıta",Yeryüzündeki altı büyük kara parçasından her biri.
"neck, cervix",the part of an organism that connects the head to the rest of the body,boyun,Gövdenin başla omuz arasında kalan bölgesi.
today,on this day as distinct from yesterday or tomorrow,bugün,içinde bulunulan gün
weak,having little physical or spiritual strength,zayıf,"Sağlamlığı, dayanıklılığı olmayan."
beat,hit repeatedly,"vurmak, dövmek",çarpmak
"allege, aver, say",report or maintain,"iddia etmek, ileri sürmek, öne sürmek, söylemek",Düşündüğünü veya bildiğini sözle anlatmak veya sözle savunmak.
"nape, scruff, nucha",the back side of the neck,ense,Boynun arkası
"dwell, live, inhabit",inhabit or live in,"yaşamak, yaşam sürmek, ikamet etmek",Bir yerde sürekli olarak kalmış ya da kalıyor olmak.
"throat, pharynx",the passage to the stomach and lungs; in the front part of the neck below the chin and above the collarbone,"boğaz, ümük, gırtlak, yutak",Boynun ön bölümü ve bu bölümü oluşturan organlar; soluk borusunun üst bölümü
"flat, level, plane","having a surface without slope, tilt in which no part is higher or lower than another","düz, engebesiz",Yüzeyinde girinti çıkıntı olmayan
support,supporting structure that holds up or provides a foundation,destek,Bir şeyin yıkılmaması için konulan eğik veya düz ağaç.
gift,something acquired without compensation,"hediye, armağan","Birini sevindirmek, mutlu etmek, onurlandırmak, kutlamak için veya anı olarak verilen şey."
soup,liquid food especially of meat or fish or vegetable stock often containing pieces of solid food,çorba,"Sebze, tahıl, et vb. ile hazırlanan sulu bir yemek türü."
herd,"keep, move, or drive animals",gütmek,evcil bir hayvanı ya da evcil hayvan sürüsünü önüne katıp otlaklara götürmek ve onlara oralarda göz kulak olmak.
shoulder,the part of the body between the neck and the upper arm,omuz,"Boynun iki yanında, kolların gövdeye bağlandığı bölüm"
"fabric, cloth, material, textile",artifact made by weaving or felting or knitting or crocheting natural or synthetic fibers,"kumaş, örtü, bez, çaput","Pamuk, yün, ipek vb.nden makinede dokunmuş her türlü dokuma"
"benefit, welfare",something that aids or promotes well-being,"fayda, yarar",Bir işten elde edilen iyi sonuç
"weather, weather condition, atmospheric condition",the meteorological conditions: temperature and wind and clouds and precipitation,"hava, hava durumu, hava şartları, hava koşulları","Belli bir yerde, belli bir anda sıcaklık, rüzgâr, nem, yağış gibi özellikler bakımından hava yuvarının durumu."
lid,a movable top or cover (hinged or separate) for closing the opening of a container,kapak,Her türlü kabın üstünü örtmeye veya bir deliği kapamaya yarayan nesne.
"wind, air current, current of air",air moving (sometimes with considerable force) from an area of high pressure to an area of low pressure,"rüzgar, esinti, hava akımı",Yüksek basınç alanlarından alçak basınç alanlarına doğru meydana gelen yatay hava akımlarının genel adı.
"thorax, chest, pectus",the part of the human torso between the neck and the diaphragm or the corresponding part in other vertebrates,"göğüs, bağır, göğüs kafesi, pektus",Memelilerde boyun ve diyafram arasındaki kısım ve diğer canlılarda bu bölgeye karşılık gelen yer.
cap,a tight-fitting headdress,kep,"Başlık, sipersiz şapka."
"moor, moorland",open land usually with peaty soil covered with heather and bracken and moss,"bozkır, kır","Şehir ve kasabaların dışında kalan, çoğu boş ve geniş yer; dağ bayır, sahra"
"breast, bosom, knocker, boob, tit, titty",either of two soft fleshy milk-secreting glandular organs on the chest of a woman,"göğüs, meme, meme ucu, meme başı","Yavrularını emzirmek için, memelilerin göğsünde türlü biçim ve sayıda bulunan, meme başı denilen çıkıntıları olan organ."
"mountain, mount",a land mass that projects well above its surroundings; higher than a hill,dağ,"Yer kabuğunun çıkıntılı, yüksek, eğimli yamaçlarıyla çevresine hâkim ve oldukça geniş bir alana yayılan bölümü."
"pass, hand, reach, pass on, turn over, give",place into the hands or custody of,"devretmek, vermek, iletmek, teslim etmek","Bir malın mülkiyetini, bir mal üzerindeki hakkı başkasına geçirmek"
"navel, umbilicus, bellybutton, omphalos, omphalus",scar where the umbilical cord was attached,"göbek, göbek deliği, göbek çukuru, umbilikus",İnsan ve memeli hayvanlarda göbek bağının düşmesinden sonra karnın ortasında bulunan çukurluk
bird,warm-blooded egg-laying vertebrates characterized by feathers and forelimbs modified as wings,kuş,"Yumurtlayan omurgalılardan, akciğerli, sıcakkanlı, vücudu tüylerle örtülü, gagalı, iki ayaklı, iki kanatlı uçucu hayvanların ortak adı."
"abdomen, venter, stomach, belly",the region of the body of a vertebrate between the thorax and the pelvis,"karın, karın boşluğu, mide, göbek",İnsan ve hayvanlarda gövdenin kaburga kenarlarından kasıklara kadar olan ön bölgesi
old,of long duration; not new,eski,"Çoktan beri var olan, üzerinden çok zaman geçmiş bulunan."
"natural elevation, elevation",a raised or elevated geological formation,"rakım, yükselti",Yer kabuğu üzerindeki bir yerin deniz seviyesine göre ölçülen yüksekliği
"back, dorsum",the posterior part of a human (or animal) body from the neck to the end of the spine,sırt,Omurgalı veya omurgasız hayvanlarda boyundan kuyruk sokumuna kadar uzanan üst bölüm.
